article_id,publish_date,title,section,author,format_type,topic,word_count,headline_length,paywalled
509,2023-08-31,Discovery Science Change Crash Breaking,politics,Emma Rodriguez,feature,politics,1552,39,1
510,2024-06-18,Climate Breaking Announces Culture Crash Change Results Government,world,David Rodriguez,news,world,860,66,0
511,2025-03-03,Crash Politics Results Politics,culture,Robert Garcia,opinion,culture,1901,31,0
512,2025-09-08,Change Change Climate Science Election Innovation Culture,politics,David Davis,analysis,politics,384,57,1
513,2023-04-22,Politics Announces Climate Culture Giant World,business,Jane Johnson,news,business,1753,46,1
514,2024-03-31,Science Science Tech Business Announces Results Change,world,David Brown,analysis,world,238,54,0
515,2025-02-27,World Tech Market World Announces Politics Announces Results,tech,Robert Rodriguez,opinion,tech,276,60,1
516,2024-09-22,Discovery Discovery Breaking Crash Discovery Change,science,Jane Williams,analysis,science,738,51,0
517,2023-02-17,Innovation Giant Study Reveals Innovation Market Crash,tech,Robert Johnson,news,tech,1904,54,0
518,2025-08-26,Crash Breaking Tech Politics Study,politics,Lisa Davis,feature,politics,231,34,0
519,2024-04-26,Breaking Politics Business Climate Crash,science,Jane Martinez,feature,science,1899,40,0
520,2023-04-15,Politics Climate Climate Announces Announces Discovery Culture,world,Lisa Jones,analysis,world,1772,62,0
521,2024-11-26,Business Business Business News Innovation Results,science,David Garcia,feature,science,1696,50,1
522,2024-04-03,Breaking Announces Business Study Politics,science,Robert Johnson,news,science,772,42,0
523,2024-05-30,Market World Giant Climate World Business Election,politics,David Williams,feature,politics,1540,50,1
524,2025-04-18,Discovery Breaking Election Reveals Results Giant Results Tech,business,David Garcia,opinion,business,1229,62,0
525,2025-06-10,Reveals Breaking Tech World Breaking Government,culture,Emma Rodriguez,feature,culture,697,47,1
526,2023-05-19,Market Reveals Giant,politics,John Jones,feature,politics,226,20,1
527,2024-04-25,Crash Announces Crash Change Announces Reveals,science,Emma Garcia,opinion,science,1111,46,1
528,2025-04-22,New Climate Breaking Politics Results,culture,Lisa Davis,news,culture,1617,37,0
529,2023-09-07,Climate Announces Discovery Discovery Discovery,world,Jane Brown,news,world,1102,47,0
530,2023-11-26,Science Government Reveals Change Innovation,culture,Lisa Williams,analysis,culture,1845,44,0
531,2024-09-24,Tech Science Election Change Tech,science,Anna Martinez,analysis,science,1104,33,0
532,2023-07-14,Culture Crash Crash Crash Culture Innovation,business,Sarah Jones,analysis,business,1527,44,0
533,2025-12-17,Discovery World Climate Election Government Giant,business,Anna Williams,opinion,business,773,49,0
534,2025-09-14,Business Study New Giant Announces Election Change,tech,James Williams,opinion,tech,424,50,1
535,2023-01-08,Reveals World Giant Breaking,science,John Brown,analysis,science,438,28,0
536,2023-09-15,World Innovation Market Government Innovation,science,Robert Rodriguez,analysis,science,1443,45,0
537,2024-09-26,Breaking Government Study,business,James Johnson,news,business,670,25,0
538,2023-09-19,Culture Discovery Election Politics Crash Government Politics,tech,Lisa Davis,news,tech,849,61,0
539,2024-08-21,Study Discovery Climate Results Climate,politics,Michael Garcia,analysis,politics,1245,39,0
540,2025-07-16,Study World Results Climate World Politics World Tech,world,Lisa Martinez,news,world,1073,53,0
541,2023-07-25,Breaking Election World,tech,Michael Martinez,news,tech,1320,23,0
542,2023-07-18,Study News Giant News Tech Innovation,business,David Jones,analysis,business,1745,37,0
543,2024-04-03,Science Business Results Discovery Business Giant Change,world,Anna Smith,news,world,370,56,1
544,2025-12-14,Market Discovery Tech Climate Climate World Tech Giant,politics,Lisa Martinez,opinion,politics,768,54,0
545,2025-01-22,Discovery Announces Innovation World New Business Election Election,tech,Sarah Brown,news,tech,1618,67,1
546,2024-02-02,Government Change Politics Science,tech,Emma Williams,news,tech,1270,34,1
547,2025-03-28,Government News Breaking Culture Reveals Business,business,James Johnson,analysis,business,1442,49,0
548,2025-02-24,Announces Reveals World,culture,Sarah Williams,news,culture,734,23,0
549,2024-10-21,Change Discovery Announces Crash Discovery News Government,business,Anna Brown,feature,business,1908,58,0
550,2023-12-13,Election Innovation Election,politics,Lisa Miller,feature,politics,646,28,0
551,2024-11-01,Crash Climate Reveals Study Breaking Science,culture,James Brown,feature,culture,1022,44,0
552,2023-02-24,World Results Government Politics Crash Study Innovation Innovation,business,John Martinez,opinion,business,367,67,0
553,2025-05-25,Tech Reveals Election Innovation Breaking Breaking,science,David Brown,opinion,science,947,50,0
554,2025-12-03,New Science Science New Culture Crash,politics,Sarah Garcia,opinion,politics,1217,37,0
555,2025-05-09,Breaking Innovation Politics Politics Culture Results,world,Lisa Rodriguez,feature,world,352,53,0
556,2025-07-20,Giant Innovation Study Innovation,tech,John Williams,feature,tech,981,33,0
557,2024-06-18,Government Announces Innovation Crash New Reveals New,business,Sarah Miller,feature,business,1184,53,0
558,2023-07-13,News Giant Market,tech,Michael Williams,news,tech,910,17,1
559,2024-04-04,Innovation Science Science Science,politics,Michael Rodriguez,analysis,politics,1533,34,0
560,2024-07-29,News Market Change Study Tech World New Government,business,Jane Rodriguez,opinion,business,401,50,0
561,2025-09-24,Crash News Business Government Government Politics Climate Innovation,culture,Sarah Rodriguez,analysis,culture,583,69,0
562,2024-12-13,Crash New Reveals Announces,world,Lisa Davis,feature,world,492,27,0
563,2023-12-21,Reveals Politics New Change Business,tech,Michael Williams,feature,tech,774,36,0
564,2024-04-14,Government Politics News Breaking Crash Results Crash,business,Anna Rodriguez,feature,business,1039,53,0
565,2023-12-05,Culture Innovation Culture World Innovation Business,tech,Lisa Miller,analysis,tech,1394,52,1
566,2023-07-19,Business Announces Politics Innovation,business,Jane Johnson,analysis,business,427,38,0
567,2025-09-19,Election Government New,business,James Smith,feature,business,1175,23,1
568,2023-09-15,Breaking Reveals Crash Politics Science Discovery New News,tech,Anna Johnson,opinion,tech,476,58,0
569,2025-06-11,Science Announces Government News Discovery News Market,politics,Anna Jones,analysis,politics,515,55,0
570,2025-02-04,Culture Innovation Giant Giant Culture Market Market Crash,business,Lisa Miller,feature,business,908,58,0
571,2025-10-25,Culture Discovery Culture New Science,politics,Robert Smith,analysis,politics,937,37,0
572,2024-04-13,Breaking New Giant News,politics,Anna Rodriguez,analysis,politics,1633,23,0
573,2024-04-23,New News Announces Tech Science News Change Study,business,John Davis,feature,business,1312,49,1
574,2024-09-03,Politics Climate Innovation World,science,James Davis,news,science,636,33,0
575,2025-01-15,Politics Business World Discovery Breaking,science,Jane Rodriguez,feature,science,1122,42,1
576,2025-12-17,Discovery Change Reveals World Announces,science,David Johnson,opinion,science,495,40,0
577,2023-10-17,Discovery News Reveals,politics,Jane Davis,feature,politics,1278,22,0
578,2024-04-10,Election Change Reveals Results Reveals,business,Robert Johnson,analysis,business,1121,39,0
579,2024-05-02,Business Innovation Results New,science,Emma Garcia,analysis,science,1477,31,1
580,2025-03-24,Culture Politics Market Crash Climate Announces,politics,Jane Martinez,analysis,politics,1875,47,0
581,2024-08-13,Market Election Government Culture Crash Reveals Science,tech,David Martinez,opinion,tech,1614,56,0
582,2023-11-17,Study Crash Reveals Government Politics New Politics,business,Lisa Johnson,news,business,1914,52,0
583,2023-01-09,Reveals Crash Politics Government,tech,Sarah Miller,analysis,tech,268,33,0
584,2025-05-16,Study Change News Government Breaking Business Innovation Business,tech,Jane Rodriguez,news,tech,894,66,0
585,2023-10-08,Discovery Innovation Politics Science,tech,Jane Martinez,analysis,tech,1260,37,0
586,2024-10-03,Giant Discovery Business Crash,science,James Garcia,analysis,science,1614,30,0
587,2025-06-25,Election Results Market Innovation Market Breaking Results,science,James Garcia,analysis,science,460,58,1
588,2024-12-08,Breaking Innovation Election World Government Study,tech,Anna Smith,feature,tech,323,51,0
589,2025-11-29,Results Science Tech Giant,politics,Lisa Garcia,feature,politics,1022,26,0
590,2025-10-16,Reveals Change Election,world,Jane Williams,opinion,world,318,23,1
591,2023-01-18,Announces Crash Crash,culture,Emma Rodriguez,feature,culture,1182,21,0
592,2025-08-07,Tech World Culture Innovation Climate Culture Innovation Government,tech,Jane Johnson,analysis,tech,1330,67,0
593,2024-02-02,Climate Innovation Reveals Climate Announces Giant Business Change,culture,Lisa Williams,news,culture,1084,66,1
594,2025-08-20,Election Tech Election Climate Culture Culture,politics,Sarah Johnson,feature,politics,1262,46,0
595,2023-12-14,News Study Innovation Market,politics,Anna Davis,analysis,politics,246,28,0
596,2023-03-08,Breaking Politics Change Crash Election Study Innovation Study,politics,Michael Garcia,news,politics,1030,62,0
597,2025-05-27,Innovation Politics Politics Study Election Election World Giant,science,Sarah Davis,feature,science,1236,64,0
598,2024-01-18,Change Business Business Culture Announces Results Giant News,world,Jane Jones,news,world,387,61,0
599,2023-05-31,Giant Market Science Climate World World Climate Discovery,politics,Jane Rodriguez,news,politics,1452,58,0
600,2024-08-13,Results Election Breaking World,business,Emma Davis,news,business,572,31,0
601,2024-04-15,Crash Science Business Giant Election,world,Jane Martinez,analysis,world,1404,37,0
602,2025-10-11,Tech Discovery Market Discovery Crash,tech,Robert Brown,analysis,tech,729,37,0
603,2023-12-10,Innovation Giant Breaking Discovery Giant New New,science,Sarah Davis,analysis,science,724,49,0
604,2023-06-17,Discovery News Change World Results World Business,culture,Sarah Garcia,news,culture,1765,50,0
605,2023-06-10,Science World Tech,politics,Sarah Johnson,news,politics,581,18,1
606,2024-02-25,Breaking Discovery Announces Business Innovation Innovation,culture,Emma Garcia,opinion,culture,392,59,0
607,2024-03-19,Reveals Science Innovation,politics,James Miller,opinion,politics,1741,26,0
608,2023-01-29,Crash Announces Change Climate Giant,tech,Emma Williams,news,tech,897,36,0
609,2024-09-24,Change Breaking Breaking Results Crash World,science,John Johnson,analysis,science,1789,44,1
610,2024-10-26,Results Giant World Breaking,science,Jane Johnson,news,science,1924,28,0
611,2025-12-01,Study Reveals Results Politics World,world,Michael Martinez,news,world,1868,36,0
612,2023-02-13,Politics Culture Discovery Giant Business,business,Emma Smith,opinion,business,1613,41,0
613,2023-08-12,Science New World,culture,Jane Garcia,opinion,culture,1533,17,0
614,2025-10-28,Government Innovation Culture Crash Change World,business,Anna Johnson,news,business,1714,48,1
615,2025-06-30,Giant Giant Business News Breaking Breaking Reveals,tech,Jane Garcia,opinion,tech,1768,51,0
616,2024-07-04,World Results New Study Science News,culture,Jane Garcia,feature,culture,1521,36,0
617,2023-12-18,Politics Climate Giant Politics,business,John Williams,news,business,346,31,0
618,2025-04-12,Results Change Change News Government World Results,science,Lisa Johnson,analysis,science,1745,51,1
619,2023-08-05,Business Reveals Change,world,Anna Williams,news,world,424,23,0
620,2024-11-26,Announces Climate Study News World Politics,business,Robert Williams,news,business,1255,43,0
621,2024-11-13,Results Election Innovation Politics Climate Discovery,science,James Jones,news,science,939,54,0
622,2023-02-25,Breaking Change News Breaking Giant,culture,Lisa Rodriguez,opinion,culture,1969,35,0
623,2024-10-15,Culture Crash Study Government Results Breaking,politics,Lisa Williams,opinion,politics,838,47,0
624,2023-08-17,Crash Giant Innovation Politics,culture,Jane Davis,analysis,culture,695,31,0
625,2024-01-10,Announces Culture News Breaking Study Government New,business,Anna Smith,news,business,1684,52,0
626,2023-08-30,Giant News Politics Science,politics,James Williams,opinion,politics,1651,27,0
627,2023-10-07,Science Reveals New Reveals Announces Study Climate,world,Emma Johnson,news,world,665,51,0
628,2024-10-21,News World Culture Election Election Tech,science,James Davis,analysis,science,247,41,1
629,2023-03-27,Breaking Culture Study Election Study Business,culture,Emma Brown,news,culture,1306,46,0
630,2023-01-17,New Business Announces World Results Politics,world,Robert Garcia,analysis,world,1242,45,0
631,2024-10-10,Innovation World World Science Market Tech Change Market,world,Robert Jones,feature,world,1001,56,1
632,2023-06-12,Discovery Study Culture Climate Innovation Tech Climate,world,Robert Davis,news,world,1367,55,1
633,2024-10-17,Discovery Science Culture Reveals News Market Giant Discovery,business,James Smith,opinion,business,1191,61,1
634,2025-03-30,Election Business Crash Reveals Innovation Discovery,business,James Rodriguez,news,business,1605,52,0
635,2024-04-18,Election Science Science Culture,culture,Sarah Rodriguez,analysis,culture,1652,32,1
636,2023-12-21,Government Discovery New,world,Michael Smith,feature,world,1164,24,0
637,2023-02-04,Science Change Government Discovery Results Innovation Breaking Results,culture,Anna Rodriguez,analysis,culture,1034,71,0
638,2025-02-19,Change Giant World News,business,Sarah Martinez,feature,business,761,23,0
639,2025-11-25,Science Innovation Tech Government,science,Robert Jones,feature,science,1754,34,0
640,2024-05-17,Culture Giant Results,politics,Anna Jones,analysis,politics,441,21,0
641,2024-02-13,Innovation Reveals Tech Government Discovery Climate World Business,tech,Michael Smith,news,tech,1403,67,0
642,2025-11-17,Market Discovery Market Study Tech Politics,tech,Anna Davis,news,tech,280,43,0
643,2024-10-30,Culture News Tech Change Science World Announces Announces,tech,John Rodriguez,analysis,tech,1457,58,1
644,2025-08-30,Change Business Science Business Government,science,Emma Rodriguez,feature,science,1736,43,1
645,2025-03-22,Innovation Innovation Innovation,science,Jane Davis,analysis,science,1310,32,1
646,2023-05-28,Government Politics News Tech,science,Lisa Jones,news,science,1812,29,1
647,2023-04-03,Culture Government Reveals Crash Innovation Results World,tech,Emma Martinez,feature,tech,729,57,1
648,2023-09-26,News Tech Tech Discovery,tech,Emma Smith,feature,tech,940,24,0
649,2024-12-17,Innovation Discovery New,business,David Miller,news,business,1802,24,0
650,2024-11-05,Change Culture News Announces Innovation,culture,Robert Smith,analysis,culture,797,40,0
651,2024-01-07,Study Election Reveals Giant Crash Change News,culture,David Rodriguez,analysis,culture,1444,46,0
652,2024-05-31,Innovation Study Innovation Reveals News New,tech,James Jones,analysis,tech,948,44,1
653,2025-12-15,World Crash Breaking Business Government Breaking New Election,science,David Davis,news,science,525,62,0
654,2023-03-18,Reveals Election Market Tech Government Discovery,politics,Lisa Smith,analysis,politics,1317,49,0
655,2024-04-15,Study Culture Business Crash Science New World Climate,tech,David Garcia,feature,tech,1033,54,0
656,2024-11-14,Politics Crash Science,business,Anna Williams,news,business,1892,22,0
657,2024-08-06,Study Reveals Business Tech Breaking Science Business,world,Lisa Martinez,feature,world,1883,53,0
658,2023-05-06,Innovation Climate Reveals Science Announces Crash Climate,science,David Smith,analysis,science,833,58,0
659,2024-12-20,Innovation Innovation World,politics,Emma Rodriguez,feature,politics,377,27,0
660,2024-08-21,Crash Study Study Tech Government,politics,Anna Smith,news,politics,677,33,1
661,2024-04-24,Discovery Study Culture Change Culture Market Tech Discovery,politics,Lisa Rodriguez,news,politics,658,60,0
662,2025-09-13,Giant Climate Crash,culture,James Garcia,opinion,culture,453,19,0
663,2023-10-31,Science Science Study,science,Jane Davis,news,science,970,21,0
664,2025-04-12,Business New Reveals World News,tech,David Rodriguez,news,tech,1964,31,0
665,2025-02-16,Results Politics Politics Innovation Culture Market New Breaking,business,Robert Brown,opinion,business,1344,64,0
666,2025-12-01,Politics Tech Change Innovation Crash Tech Change,politics,Robert Jones,news,politics,1890,49,0
667,2023-04-10,Giant Election Change Results Crash Giant Study,politics,Emma Garcia,news,politics,628,47,1
668,2025-11-14,Culture News New Election Election,science,David Davis,opinion,science,1211,34,1
669,2024-08-28,Reveals Study Change Crash Business,culture,James Brown,feature,culture,1287,35,0
670,2023-06-29,New Market Innovation,culture,David Jones,analysis,culture,1440,21,0
671,2024-06-22,Culture Election Giant New Discovery,business,Jane Brown,opinion,business,1912,36,1
672,2024-12-13,Breaking Results Business Giant Breaking News,politics,Jane Williams,feature,politics,723,45,1
673,2023-07-30,Tech Market Culture Market Tech Results,world,James Williams,news,world,1183,39,0
674,2024-06-30,New Government Results Discovery Culture Results,science,Robert Williams,analysis,science,1652,48,0
675,2025-07-18,Giant News Climate Change Election World,politics,David Rodriguez,opinion,politics,1023,40,0
676,2024-12-03,Giant Business Crash Government,politics,David Williams,analysis,politics,864,31,0
677,2023-12-09,Science Election Study,culture,Anna Garcia,news,culture,1541,22,1
678,2023-03-17,Politics Climate Market Climate Climate Discovery,politics,James Rodriguez,news,politics,925,49,0
679,2025-04-18,Breaking Government Business Election Science Study,world,Lisa Williams,analysis,world,1127,51,0
680,2025-09-15,Election Innovation Business Business Announces New Reveals Election,science,Michael Garcia,news,science,960,68,1
681,2023-02-03,Study Science Business Culture,tech,Lisa Garcia,opinion,tech,525,30,0
682,2025-10-17,World Culture Election Election Giant Change,world,Robert Davis,analysis,world,1615,44,0
683,2023-07-20,Innovation Science New New,business,Sarah Brown,opinion,business,1359,26,0
684,2023-09-23,Tech Change Tech Climate,world,John Johnson,news,world,634,24,0
685,2024-02-29,Government Announces Crash Change Study,politics,Emma Garcia,news,politics,826,39,0
686,2025-11-28,Business Results Breaking Politics Innovation Culture Results,world,Jane Johnson,news,world,300,61,0
687,2023-08-30,Giant Innovation Innovation Announces Reveals,science,David Martinez,news,science,1160,45,0
688,2025-08-14,Politics Announces Science,politics,Lisa Davis,news,politics,1289,26,0
689,2024-08-14,Innovation Culture Change,science,Sarah Martinez,analysis,science,866,25,0
690,2025-05-07,Climate Government Government Change,science,Anna Miller,news,science,1621,36,1
691,2024-02-04,Business Culture Culture Announces Election,culture,James Miller,opinion,culture,629,43,0
692,2023-01-02,Science World Breaking Crash World,culture,Jane Brown,feature,culture,978,34,0
693,2023-06-05,Tech Politics Change,tech,James Johnson,news,tech,1082,20,1
694,2025-09-07,Announces Market Crash,world,Robert Smith,opinion,world,449,22,0
695,2023-08-03,Announces New Election Tech Market Crash Giant,world,Sarah Johnson,feature,world,785,46,1
696,2025-10-15,Election Politics Climate World Breaking,business,Lisa Brown,analysis,business,1259,40,0
697,2023-10-13,World World Culture Tech Tech Business Reveals,tech,Sarah Rodriguez,analysis,tech,1141,46,0
698,2025-08-21,Government Breaking News Science Climate Announces New Culture,tech,Sarah Smith,feature,tech,1235,62,0
699,2024-03-05,Culture Crash News,tech,Michael Rodriguez,opinion,tech,1524,18,0
700,2025-01-19,Market Science Climate Change Change,science,Robert Miller,opinion,science,688,36,0
701,2024-10-11,Election Results Reveals Culture News Election,tech,James Martinez,feature,tech,1887,46,0
702,2024-12-16,Politics Tech Crash Market Market Breaking Climate Election,politics,David Johnson,opinion,politics,1466,59,0
703,2025-01-23,News Climate Science Breaking Climate,world,Sarah Smith,feature,world,972,37,0
704,2024-01-20,Government Climate Announces Government New Politics Results Announces,science,David Smith,analysis,science,1506,70,0
705,2025-12-03,Politics Climate Innovation World World Tech,business,Anna Garcia,feature,business,1362,44,0
706,2023-06-10,Breaking Innovation News Culture New Culture Government,business,Michael Smith,news,business,1220,55,1
707,2025-06-27,Science Change Climate,science,Lisa Brown,analysis,science,601,22,0
708,2023-12-01,Breaking Study Election Election,tech,Michael Smith,analysis,tech,655,32,0
709,2023-06-23,Government Announces Innovation,business,John Jones,feature,business,471,31,0
710,2024-10-19,Innovation Business Business News New Giant Giant,business,Lisa Smith,opinion,business,1796,49,0
711,2025-05-25,Climate Discovery News Study Results Culture Culture,politics,Anna Smith,feature,politics,259,52,0
712,2024-03-09,Reveals Climate World Government Reveals Politics Tech,business,Robert Brown,analysis,business,1938,54,0
713,2024-09-06,Giant Culture Reveals,business,Robert Smith,analysis,business,588,21,0
714,2025-03-14,Breaking News Politics,world,Anna Johnson,news,world,1425,22,1
715,2025-12-15,New Announces Breaking Change Reveals Giant Breaking News,business,Michael Smith,feature,business,1323,57,0
716,2025-04-04,Market Climate Government Tech Giant,tech,Michael Martinez,news,tech,655,36,0
717,2024-05-29,Market Study Market Climate Culture Study Market,tech,Anna Williams,opinion,tech,759,48,0
718,2023-02-20,Election Science Breaking World Innovation Announces Giant Politics,world,Emma Johnson,news,world,1527,67,0
719,2025-07-14,Election World Innovation Discovery New Business Giant Reveals,science,David Rodriguez,analysis,science,243,62,1
720,2023-01-11,Crash Election Science Results Discovery Discovery Business New,tech,Jane Martinez,analysis,tech,1108,63,0
721,2023-08-18,Science Innovation News Climate Breaking Politics,business,Michael Davis,feature,business,1241,49,0
722,2024-09-04,Change News Business Government Politics,politics,Lisa Davis,analysis,politics,272,40,0
723,2024-10-06,Breaking Results Discovery Science Reveals,business,Sarah Martinez,analysis,business,749,42,0
724,2023-12-01,New Business Discovery Results Giant Innovation Politics,tech,Sarah Martinez,news,tech,1776,56,0
725,2023-08-31,Study Business Election Culture Government,politics,Anna Jones,news,politics,725,42,0
726,2023-11-14,Reveals Change News,politics,John Miller,opinion,politics,698,19,0
727,2024-02-23,Reveals World Results Innovation Business Government World Breaking,world,John Rodriguez,news,world,1557,67,0
728,2024-03-22,Discovery News Giant Science Reveals,world,Anna Brown,analysis,world,1533,36,1
729,2024-08-23,Discovery Change Tech New Business Climate Innovation,culture,Robert Brown,feature,culture,1845,53,1
730,2023-05-23,Reveals Change Politics New Crash Climate Election,tech,Emma Davis,news,tech,776,50,0
731,2023-06-11,Election Innovation Crash Breaking News,tech,Anna Smith,feature,tech,1221,39,0
732,2025-08-24,New Giant Election,world,James Martinez,feature,world,825,18,0
733,2023-07-27,Climate Breaking Breaking,science,Michael Miller,news,science,1156,25,0
734,2024-12-23,Market Climate Announces Tech Politics Government Science,science,David Martinez,feature,science,1245,57,0
735,2025-10-02,Election Tech Science Business Innovation Market Culture New,culture,Michael Rodriguez,feature,culture,1952,60,1
736,2024-12-20,Business Innovation Results Culture Results Discovery,business,John Martinez,opinion,business,1255,53,0
737,2024-05-01,Reveals Election Discovery Culture Election Tech,business,John Jones,feature,business,306,48,0
738,2025-05-21,Giant Election Market,world,Michael Jones,news,world,1723,21,0
739,2024-06-27,Change Announces Business,politics,Robert Davis,news,politics,1514,25,0
740,2023-02-17,Breaking Discovery Results News Culture Government,business,Robert Davis,news,business,618,50,0
741,2025-11-24,Culture Study Change Government Innovation Climate Giant,politics,Sarah Garcia,news,politics,1919,56,0
742,2023-06-01,Tech Breaking Crash Culture Change Innovation Election,science,Michael Brown,feature,science,1358,54,0
743,2024-03-16,Innovation Culture Market Election Science Giant Climate News,tech,James Rodriguez,news,tech,891,61,0
744,2025-08-07,News Reveals Crash Results Science,tech,Sarah Garcia,analysis,tech,728,34,0
745,2025-02-19,World Market Election Results,politics,Anna Johnson,news,politics,1337,29,1
746,2024-06-20,Results Results Science Market,business,Emma Rodriguez,feature,business,506,30,0
747,2025-11-18,Innovation Reveals Tech Discovery News Culture Discovery,science,David Garcia,analysis,science,1880,56,0
748,2024-11-23,Study Politics Breaking Innovation Giant Announces Politics,politics,James Garcia,analysis,politics,1189,59,0
749,2024-11-11,Tech Politics Culture Election Politics Crash Business,science,Robert Brown,analysis,science,342,54,0
750,2023-08-28,World Business Government Tech Culture Election Results Election,politics,David Brown,feature,politics,1483,64,1
751,2025-10-29,Culture Culture Crash Study,culture,John Davis,opinion,culture,1633,27,0
752,2023-11-06,Government Election Innovation,business,David Rodriguez,opinion,business,1315,30,0
753,2025-01-19,Breaking Results Crash,business,Emma Rodriguez,news,business,777,22,0
754,2025-02-20,Giant Announces Change,tech,James Martinez,feature,tech,394,22,0
755,2024-09-12,Business Reveals New Announces Giant,tech,Sarah Garcia,opinion,tech,878,36,0
756,2024-01-02,Study Announces Study,business,David Jones,analysis,business,1715,21,0
757,2025-10-01,Crash Crash Giant Science Science Reveals Breaking Government,culture,Sarah Jones,opinion,culture,1608,61,1
