article_id,publish_date,title,section,author,format_type,topic,word_count,headline_length,paywalled
1,2024-02-19,Government Climate Tech Climate Study,world,John Rodriguez,news,world,559,37,0
2,2024-04-07,Politics Study Tech,culture,Anna Johnson,opinion,culture,539,19,0
3,2023-06-28,Politics Market Results Innovation,culture,Jane Davis,news,culture,1345,34,0
4,2024-06-09,Change World Discovery Breaking Tech Innovation News,world,John Brown,feature,world,1003,52,0
5,2023-07-14,Tech Politics News,science,Lisa Williams,analysis,science,1997,18,0
6,2025-07-26,Government Climate Change Study Climate World Business News,science,Michael Rodriguez,news,science,1798,59,0
7,2025-11-03,Culture Tech Tech Announces,world,Jane Miller,opinion,world,445,27,0
8,2024-10-26,News Politics Science Tech Giant Giant,science,James Johnson,news,science,1638,38,0
9,2024-08-24,Election World Breaking Culture Announces Politics Crash Giant,science,David Smith,analysis,science,733,62,0
10,2024-12-09,Breaking Innovation Crash Results Politics,science,David Brown,analysis,science,1829,42,0
11,2025-10-07,News New Government,world,Emma Garcia,news,world,1093,19,0
12,2025-08-10,Market Culture Science News,business,Michael Williams,opinion,business,1018,27,1
13,2023-12-14,Discovery World Breaking,tech,David Williams,analysis,tech,1975,24,0
14,2025-10-13,Business Change Climate,culture,Michael Brown,analysis,culture,872,23,0
15,2025-04-19,Breaking New Election Politics Crash,culture,Jane Garcia,opinion,culture,1746,36,1
16,2023-01-26,Crash Science Announces Government,tech,John Smith,opinion,tech,1135,34,0
17,2024-06-02,Change Politics Science,world,Robert Garcia,opinion,world,1513,23,0
18,2023-07-30,Results Election Business Results Giant Study Crash Business,tech,Lisa Smith,news,tech,508,60,0
19,2025-07-20,Tech Tech Reveals,politics,John Martinez,news,politics,300,17,0
20,2024-08-15,Government Crash Change Announces News Change Crash,tech,Lisa Johnson,feature,tech,1071,51,0
21,2024-07-08,Innovation Culture Breaking New Innovation Change Government,business,David Martinez,analysis,business,1563,60,0
22,2024-01-08,Politics Politics Business New Election Government Politics,science,James Jones,news,science,1700,59,1
23,2025-04-23,Study Change Market Culture New Politics Climate Culture,business,Emma Jones,opinion,business,1379,56,0
24,2024-06-27,Climate News Crash Innovation,science,James Brown,analysis,science,1350,29,0
25,2024-05-04,Announces Science New Breaking Business Giant Giant Reveals,science,David Brown,analysis,science,1959,59,1
26,2025-06-23,Election Change Election Breaking Change World Results,science,Jane Rodriguez,feature,science,1716,54,0
27,2025-07-25,Government Business Announces Innovation Giant Crash Change Discovery,tech,Emma Rodriguez,opinion,tech,354,69,1
28,2025-11-12,Study News Election,business,James Rodriguez,feature,business,1688,19,1
29,2025-07-11,Study Announces Politics News Market Innovation Results,politics,Robert Johnson,opinion,politics,1941,55,0
30,2025-08-13,Culture Culture Tech,world,Michael Miller,analysis,world,1041,20,0
31,2023-11-05,Climate Election Crash Culture World Business News,tech,David Martinez,news,tech,1994,50,0
32,2023-06-15,Market Results Culture Results World Science Reveals,world,Lisa Jones,news,world,1019,52,0
33,2023-08-05,Discovery Politics Results New Government Culture Market,world,Lisa Garcia,feature,world,846,56,0
34,2024-08-03,Government Giant Discovery Results Election Culture Tech Results,science,Michael Davis,opinion,science,332,64,0
35,2023-03-13,Tech Change Announces Change Tech Culture Politics,world,James Rodriguez,analysis,world,1945,50,1
36,2024-08-10,World New Culture Culture Science Market Breaking Tech,business,David Smith,news,business,1066,54,0
37,2023-05-21,Business Giant Politics Innovation Government Government Market,world,John Williams,news,world,374,63,0
38,2024-12-22,Breaking Reveals Business Reveals Announces,business,James Johnson,analysis,business,873,43,0
39,2025-05-08,World News Reveals Business Crash Results,politics,Lisa Miller,analysis,politics,312,41,1
40,2023-06-02,Election Politics New Change News,tech,Anna Martinez,feature,tech,1129,33,0
41,2023-10-21,Tech Change Culture Tech Climate Discovery,culture,Michael Rodriguez,analysis,culture,1417,42,0
42,2023-10-04,Climate Giant Culture Change Business Announces Discovery,science,James Brown,news,science,1585,57,0
43,2023-02-10,Innovation Business Politics Discovery Government Study,world,John Rodriguez,analysis,world,1139,55,0
44,2024-03-06,Culture Election Election Results Breaking Announces Giant Innovation,world,Michael Rodriguez,analysis,world,1705,69,0
45,2023-03-31,Study Giant Market Science Climate World Results,business,Jane Rodriguez,analysis,business,835,48,0
46,2023-11-12,Giant Climate Reveals Culture Climate New Politics Results,tech,Anna Jones,opinion,tech,1760,58,1
47,2024-06-11,Change Giant Discovery New Change Culture New World,business,Michael Rodriguez,feature,business,1342,51,0
48,2025-02-12,Breaking Innovation Business,tech,Emma Garcia,news,tech,1897,28,1
49,2025-01-16,Discovery Reveals Giant New Crash,politics,David Brown,opinion,politics,772,33,0
50,2024-03-31,Reveals Politics Culture Announces Culture Giant,politics,Lisa Johnson,analysis,politics,1268,48,0
51,2024-08-20,New Business Discovery Politics Election New,tech,Anna Smith,opinion,tech,1714,44,0
52,2025-11-28,Crash Politics News Market News,world,David Martinez,analysis,world,1345,31,1
53,2025-01-21,Climate Innovation Study,science,Anna Martinez,feature,science,1750,24,0
54,2024-01-09,Tech Change Results Innovation,science,Emma Rodriguez,analysis,science,714,30,0
55,2023-02-03,Innovation Reveals Climate,science,Jane Brown,opinion,science,1942,26,0
56,2024-05-30,Crash Politics New Culture Government Election Breaking,politics,Sarah Smith,feature,politics,1035,55,0
57,2023-01-13,Government Election Discovery Change,world,Lisa Johnson,news,world,1700,36,0
58,2023-03-10,Tech Results Culture Results,science,David Smith,analysis,science,343,28,0
59,2025-01-24,Announces Market Discovery New Market,science,Robert Jones,feature,science,911,37,0
60,2024-02-13,World Tech Culture Election Results Election Breaking,business,John Jones,news,business,1656,53,1
61,2025-07-16,Announces Breaking Announces Results Announces,politics,Robert Garcia,feature,politics,1709,46,0
62,2025-10-02,Innovation Change Announces Announces,science,David Davis,feature,science,282,37,1
63,2024-06-20,Crash Business Election New,business,James Williams,analysis,business,414,27,1
64,2025-09-09,Culture Discovery New Climate Government Tech,world,James Smith,news,world,1324,45,0
65,2023-10-18,Politics Results Innovation New,business,Emma Miller,analysis,business,1051,31,0
66,2024-11-01,New Discovery Innovation Change World Study New Election,science,David Johnson,opinion,science,1440,56,0
67,2023-05-01,Discovery Climate Innovation Market Business,culture,Emma Rodriguez,feature,culture,1199,44,0
68,2025-12-23,World Climate Study Market Climate Discovery,politics,James Davis,opinion,politics,1334,44,0
69,2024-04-24,Announces Business Tech Announces Election Election News,science,Lisa Miller,feature,science,827,56,0
70,2023-03-08,Tech Reveals Innovation Politics Announces News,tech,David Davis,analysis,tech,617,47,1
71,2025-10-10,News Business Crash Results Announces,world,John Miller,news,world,1293,37,1
72,2023-06-14,Change Culture Results Crash Market,business,David Miller,opinion,business,494,35,0
73,2025-12-10,Giant World World Reveals Change Discovery Discovery Study,culture,Robert Williams,news,culture,306,58,0
74,2023-08-24,Culture Giant World Tech Innovation,politics,James Jones,analysis,politics,669,35,0
75,2024-09-01,Crash Reveals News News,world,Lisa Garcia,opinion,world,897,23,1
76,2023-11-26,Government Results Reveals Study,world,John Smith,opinion,world,1320,32,0
77,2024-12-26,News Innovation New Climate Market,world,Anna Williams,analysis,world,801,34,0
78,2023-05-07,Announces Announces Tech Government Climate,science,Sarah Brown,feature,science,569,43,0
79,2023-07-31,Government Discovery Change,business,Robert Martinez,opinion,business,1165,27,1
80,2024-11-16,Change New Study,world,John Rodriguez,opinion,world,618,16,1
81,2025-03-24,Giant Market News Innovation Tech Innovation New,culture,Robert Davis,feature,culture,1655,48,0
82,2025-07-19,Study Business Change,politics,Robert Garcia,news,politics,448,21,0
83,2025-05-27,Announces Announces Climate Reveals Science Innovation,culture,James Rodriguez,feature,culture,883,54,0
84,2023-08-31,New Giant Market,business,Robert Jones,news,business,963,16,0
85,2025-04-26,World World News,business,David Davis,feature,business,852,16,0
86,2025-09-09,Politics Results Market Discovery,politics,Anna Martinez,opinion,politics,1613,33,0
87,2024-09-10,Government Innovation Tech World,tech,David Miller,analysis,tech,1038,32,1
88,2024-04-21,Government Election Discovery,culture,John Garcia,opinion,culture,1941,29,0
89,2023-05-31,Election Announces Breaking Study Crash Change,tech,Sarah Williams,opinion,tech,1707,46,1
90,2024-10-27,Science Innovation Giant News Discovery Results,tech,Anna Johnson,feature,tech,968,47,1
91,2025-02-05,Climate Study Culture Market Announces Politics,world,John Garcia,opinion,world,333,47,0
92,2023-06-09,Reveals Change Politics Change Government,politics,Lisa Johnson,feature,politics,1751,41,0
93,2023-06-04,Climate Results Government Reveals New,business,John Williams,news,business,1180,38,0
94,2024-03-01,Culture Discovery Election,world,James Martinez,feature,world,1693,26,0
95,2025-10-25,Government New Climate World Innovation Tech Tech,culture,James Smith,news,culture,1040,49,0
96,2023-11-22,Reveals News Innovation Tech Study,science,Michael Brown,opinion,science,693,34,0
97,2025-02-27,Change Government Tech Breaking Study Announces New,science,Robert Johnson,news,science,244,51,0
98,2025-09-11,Culture Breaking Study Government Market Climate Politics Innovation,world,Anna Brown,feature,world,1040,68,0
99,2023-02-08,Politics Politics World Announces Government Results Science Science,tech,Lisa Rodriguez,news,tech,1454,68,0
100,2025-04-01,Business Announces Culture Study Government Announces Results,science,Jane Brown,analysis,science,744,61,1
101,2025-09-12,Innovation Change News News Science Climate Climate,culture,Emma Miller,news,culture,1663,51,1
102,2023-05-17,Politics Climate Change Government Election Discovery Crash,politics,Robert Williams,opinion,politics,754,59,0
103,2024-03-30,Crash Market Innovation Crash Giant,world,Anna Johnson,feature,world,920,35,0
104,2024-08-11,Climate Market Crash Discovery,science,David Miller,analysis,science,352,30,1
105,2023-02-08,Market Crash Announces Giant Study Market Crash,tech,Robert Garcia,feature,tech,1059,47,0
106,2023-07-15,World Market Crash Business Science Science Election,business,Jane Miller,opinion,business,830,52,0
107,2024-11-10,World Business Climate,world,Michael Jones,news,world,709,22,1
108,2024-05-14,Politics Market Discovery Breaking World Tech,culture,Emma Jones,feature,culture,1787,45,1
109,2025-09-11,Politics Tech Reveals Change Innovation New Giant Business,business,Robert Martinez,analysis,business,1536,58,1
110,2023-12-10,Breaking Election Announces,world,Jane Miller,opinion,world,1811,27,0
111,2024-04-03,Crash Announces Announces Giant,tech,Lisa Rodriguez,analysis,tech,1994,31,1
112,2025-08-01,Business Announces Climate Tech Election Discovery,tech,Jane Williams,feature,tech,1689,50,0
113,2025-11-09,Change Government Science Climate Study,world,John Garcia,news,world,1958,39,0
114,2025-05-21,Study Breaking Announces Study,science,James Miller,news,science,1610,30,0
115,2023-07-14,Announces Innovation Politics Science Culture Business Study Discovery,tech,Emma Williams,opinion,tech,615,70,0
116,2025-12-11,Election Government Results Study Tech Reveals World,business,David Garcia,feature,business,464,52,1
117,2025-05-25,Science Climate Innovation Change,business,Emma Davis,news,business,1446,33,0
118,2024-06-17,Business Election Business New World Government Government Science,science,David Smith,opinion,science,997,66,1
119,2023-06-26,Culture Innovation New Change,tech,Lisa Williams,analysis,tech,1831,29,1
120,2024-07-07,Science Tech Government Business Climate Election Breaking,tech,John Smith,analysis,tech,1431,58,0
121,2025-04-06,Announces Study Politics Market Discovery Breaking Government Politics,business,David Smith,news,business,1737,70,0
122,2023-03-25,Culture Reveals Results Election Election,politics,Emma Martinez,feature,politics,1969,41,0
123,2024-09-24,Culture Giant World Politics,world,James Miller,feature,world,1165,28,0
124,2024-08-19,World Election New Market Science Reveals Study Change,business,James Garcia,analysis,business,1600,54,0
125,2024-12-06,Breaking Science Culture Giant Giant Giant,science,Anna Garcia,opinion,science,1353,42,0
126,2024-09-10,Change Discovery News World World Innovation Crash,business,Sarah Davis,news,business,1255,50,0
127,2024-12-10,Breaking Government Results Science,business,Sarah Martinez,analysis,business,548,35,0
128,2024-12-12,Breaking Climate Innovation News Climate Science,world,James Davis,feature,world,1639,48,0
129,2024-11-02,Change Study Climate Election Giant Politics,politics,Anna Johnson,feature,politics,850,44,0
130,2025-10-17,Climate Innovation Breaking World Election Breaking,politics,Emma Miller,feature,politics,368,51,0
131,2024-02-02,Government Politics Announces Politics Reveals Culture Discovery Results,culture,Sarah Johnson,news,culture,1334,72,0
132,2025-10-09,News News Study Giant Change Study World,business,Anna Davis,analysis,business,951,40,0
133,2024-06-11,Culture Reveals Announces Science Politics Innovation,culture,John Garcia,news,culture,1814,53,1
134,2024-01-16,Climate Market World,science,James Garcia,analysis,science,347,20,0
135,2023-02-09,Crash Government Election Government News,world,John Williams,opinion,world,768,41,0
136,2024-06-05,News New Reveals,world,James Jones,news,world,784,16,0
137,2024-04-17,Tech Government Culture Results Breaking,world,Anna Martinez,news,world,1026,40,1
138,2023-07-19,Reveals Change Innovation Reveals,politics,Sarah Smith,opinion,politics,1033,33,0
139,2023-09-22,Announces News Crash Announces,politics,Jane Johnson,opinion,politics,1856,30,0
140,2025-02-13,Tech Reveals Election Discovery,culture,Anna Davis,news,culture,619,31,0
141,2023-07-05,Government Crash Crash Science Giant Climate Science World,business,Lisa Miller,feature,business,1340,58,0
142,2024-04-02,Election Politics New Announces Government World,tech,Michael Miller,news,tech,281,48,1
143,2025-04-10,Science Tech Study Science Crash Climate Science News,culture,Jane Smith,news,culture,747,53,1
144,2025-12-13,Giant Culture Announces Tech New Business,business,Robert Garcia,news,business,1541,41,1
145,2025-07-07,Giant Study Study Market Announces Climate Results Culture,tech,Lisa Brown,opinion,tech,1586,58,0
146,2023-08-23,Results Giant World Business,culture,Jane Smith,news,culture,799,28,0
147,2023-07-04,Culture Business Discovery Innovation,culture,John Brown,analysis,culture,1046,37,0
148,2024-02-17,Tech Discovery News Results Innovation,tech,Lisa Jones,analysis,tech,1140,38,1
149,2024-09-18,Breaking Results Science Change Tech Culture,politics,Robert Smith,news,politics,858,44,1
150,2024-06-05,Science Results Results New Tech Change Change Giant,tech,Anna Davis,opinion,tech,1418,52,1
151,2025-12-13,Politics Announces World Government Innovation,world,John Johnson,feature,world,1187,46,1
152,2023-07-24,Innovation Market Politics,tech,Robert Johnson,analysis,tech,430,26,0
153,2025-02-17,World Reveals News,business,Sarah Garcia,feature,business,902,18,0
154,2024-07-17,Results Climate Study Culture,tech,Lisa Miller,analysis,tech,571,29,1
155,2025-03-04,Reveals Crash Announces Politics,tech,Sarah Williams,news,tech,1466,32,0
156,2024-02-13,News New World Government Study Government Reveals,tech,Sarah Brown,opinion,tech,550,50,1
157,2023-06-09,News Discovery Market Reveals Innovation Discovery Change,world,Emma Jones,analysis,world,1933,57,0
158,2024-04-12,Discovery News Government World Culture Results Breaking News,science,Anna Smith,news,science,735,61,0
159,2025-07-08,Giant Announces Discovery Results Change,science,Sarah Garcia,news,science,1413,40,0
160,2025-12-16,Announces Science Business Science Tech,world,Michael Miller,feature,world,1670,39,1
161,2024-04-01,World Politics Results Market,politics,John Johnson,analysis,politics,1808,29,1
162,2024-09-08,Business Results Giant Change Giant Change,business,Lisa Smith,news,business,844,42,0
163,2023-12-23,Crash World Culture Giant Climate Announces,business,Michael Smith,feature,business,1038,43,0
164,2023-10-06,Climate Change Discovery Giant,tech,Emma Smith,feature,tech,836,30,0
165,2023-09-27,Reveals New Innovation Breaking Giant,world,Sarah Williams,analysis,world,1588,37,0
166,2025-05-27,Election Reveals Reveals,science,James Davis,news,science,1301,24,0
167,2024-10-07,Science Politics Innovation Climate Crash Announces Crash Politics,world,Emma Miller,opinion,world,1278,66,1
168,2023-12-13,Giant Government Politics,culture,David Miller,feature,culture,1903,25,0
169,2023-08-06,World Discovery World Government Election Politics Election,science,David Smith,analysis,science,664,59,1
170,2024-09-09,News Business Politics Innovation New Breaking,science,Jane Smith,news,science,1932,46,0
171,2024-11-28,Study Reveals News,culture,James Smith,opinion,culture,541,18,0
172,2023-12-03,Climate Election Culture Climate Change Discovery Results Market,culture,James Rodriguez,feature,culture,1514,64,1
173,2025-03-07,Market Innovation Reveals Announces Change Government Business Crash,politics,Jane Davis,analysis,politics,1108,68,0
174,2023-01-26,News Culture Culture Business Tech Announces Giant Results,science,Emma Brown,feature,science,1396,58,1
175,2024-06-22,Results Politics Change Announces Change Innovation,politics,Robert Garcia,analysis,politics,527,51,0
176,2025-09-07,Election Business Science Results,politics,Sarah Martinez,analysis,politics,349,33,0
177,2025-08-13,News New Breaking World Culture Innovation Market,science,Michael Johnson,news,science,679,49,0
178,2024-12-24,Study Election Reveals Change Innovation Study Reveals Tech,politics,Emma Smith,feature,politics,397,59,1
179,2024-11-01,Giant New Science Politics Market Tech New Results,politics,Anna Williams,analysis,politics,986,50,1
180,2025-05-10,Climate Climate Results Culture,culture,Lisa Smith,opinion,culture,1621,31,1
181,2024-10-18,Tech Election Climate Culture,culture,David Williams,feature,culture,1784,29,0
182,2025-08-17,Results Breaking New Business Giant Government Innovation News,politics,Lisa Johnson,feature,politics,1628,62,1
183,2025-12-16,Government Results Reveals Reveals Announces Breaking Science,science,Emma Davis,news,science,1290,61,1
184,2024-10-21,Change Discovery Crash Market Announces Business Innovation New,politics,David Jones,news,politics,1094,63,0
185,2023-06-12,Election Breaking News Market Announces Announces Business,tech,James Miller,feature,tech,374,58,0
186,2023-08-26,Innovation Announces Discovery Crash Discovery Results Discovery,culture,Anna Martinez,opinion,culture,1305,64,0
187,2024-07-31,Government Reveals Crash Announces News,tech,John Williams,feature,tech,1015,39,1
188,2023-11-26,Election Science Change Culture Government Breaking Results Business,world,James Williams,analysis,world,1678,68,0
189,2023-04-27,Culture Innovation Business Change Breaking Tech Announces World,culture,Sarah Williams,opinion,culture,1387,64,0
190,2024-10-09,Climate Business Innovation,culture,James Brown,analysis,culture,1111,27,0
191,2025-12-14,News Government Business Announces Science Science Reveals Climate,tech,John Martinez,news,tech,338,66,0
192,2024-08-19,Discovery Change Reveals Breaking Election,business,Robert Williams,news,business,1535,42,0
193,2024-07-10,Announces News Market Business,world,John Martinez,feature,world,1097,30,0
194,2024-02-19,Science World Culture Reveals,culture,Jane Williams,opinion,culture,1058,29,1
195,2025-08-14,Innovation Study Business Reveals Business Results Politics,tech,Emma Davis,opinion,tech,1283,59,0
196,2025-05-22,Change Innovation Science Discovery Reveals,tech,Michael Smith,news,tech,1314,43,0
197,2024-11-18,Crash Tech Government New,business,Anna Garcia,analysis,business,772,25,0
198,2025-01-26,Market News Election New Government Study,science,Robert Johnson,analysis,science,739,41,0
199,2025-09-14,Government Reveals Culture,science,Jane Rodriguez,feature,science,1338,26,0
200,2024-03-22,Innovation Government Business Crash Climate,science,Anna Smith,opinion,science,1905,44,0
201,2025-03-31,Election Study Election Business Science Tech Breaking Tech,politics,David Brown,news,politics,731,59,1
202,2025-04-10,Reveals Business Election Science,culture,Robert Rodriguez,analysis,culture,1496,33,0
203,2024-12-11,Election News Crash Tech Reveals Results Discovery,tech,Emma Davis,news,tech,1774,50,1
204,2023-12-15,World Change Change Science Giant Giant Announces,business,Jane Smith,opinion,business,1186,49,0
205,2023-06-26,Tech Climate New Market Business,tech,Michael Rodriguez,opinion,tech,958,32,0
206,2024-01-21,Breaking Innovation Announces Election Market Change Science Market,tech,Emma Davis,news,tech,401,67,0
207,2023-01-24,Government Study Climate,culture,Michael Brown,opinion,culture,1937,24,0
208,2025-08-02,Breaking Climate Tech Change Tech Election,tech,David Brown,analysis,tech,933,42,1
209,2025-10-19,Election Results Discovery World Business New,tech,Anna Garcia,opinion,tech,1324,45,0
210,2023-06-14,Announces Government Climate Study,culture,James Martinez,analysis,culture,1046,34,0
211,2023-06-19,Crash Government New Climate Reveals World Results Breaking,business,Jane Davis,analysis,business,1268,59,0
212,2024-12-10,Business Results Election,politics,Emma Garcia,news,politics,1202,25,1
213,2024-02-26,Results Election Innovation Government World Science Business,science,David Davis,opinion,science,559,61,1
214,2024-05-22,Study Culture News Politics Innovation Study Government,business,Emma Brown,opinion,business,895,55,0
215,2023-03-05,Change Government Study Announces,world,Michael Rodriguez,news,world,1720,33,1
216,2023-03-21,Election Market Culture Reveals Science Politics Reveals,world,Michael Smith,news,world,451,56,0
217,2024-07-01,Crash Election News,world,Lisa Miller,opinion,world,933,19,0
218,2025-09-13,Election Results Tech Study Innovation Crash Politics,science,Jane Smith,analysis,science,1745,53,0
219,2024-04-19,Giant Breaking Business Study Climate Election,science,Robert Garcia,news,science,1613,46,0
220,2023-10-18,Politics Innovation Reveals Business Study Science,business,John Miller,news,business,1944,50,0
221,2025-02-03,Election Results Market Business Election Announces,world,Jane Jones,analysis,world,857,51,0
222,2024-04-23,Discovery Innovation World Business Science,science,James Smith,opinion,science,598,43,1
223,2025-03-01,Government Giant Business Business,politics,Lisa Smith,opinion,politics,1774,34,0
224,2025-06-23,Government Discovery Election Climate,politics,Lisa Garcia,news,politics,1118,37,0
225,2025-03-17,Climate Breaking Business Tech New Market Election,tech,James Davis,news,tech,1530,50,0
226,2023-10-19,Science Study Government Announces Study Crash Crash,science,John Williams,feature,science,1276,52,0
227,2023-10-24,Study Business Government,culture,Jane Brown,analysis,culture,1751,25,0
228,2025-05-09,New Crash Business Tech Tech Discovery Breaking,culture,Lisa Brown,opinion,culture,1212,47,1
229,2024-08-27,Culture Results Business Reveals World,culture,Lisa Martinez,feature,culture,931,38,0
230,2024-09-28,Politics Election Crash Announces Change Crash Culture World,culture,James Miller,news,culture,1454,60,1
231,2025-11-28,Culture Innovation Politics Politics,business,Michael Johnson,feature,business,1264,36,1
232,2023-06-14,Announces Study Change Politics,culture,David Jones,news,culture,587,31,0
233,2024-09-10,Culture News Study New,politics,Sarah Jones,feature,politics,1035,22,0
234,2025-11-22,Study Discovery World Climate Discovery Change Politics,business,Emma Brown,opinion,business,1698,55,0
235,2023-03-24,Climate Study Reveals Breaking Politics Tech Change Giant,tech,Robert Davis,analysis,tech,484,57,1
236,2025-05-15,Discovery Business World Reveals,culture,John Martinez,opinion,culture,1213,32,0
237,2023-10-04,Results Giant World,business,Sarah Garcia,news,business,852,19,0
238,2025-10-19,Innovation Culture Tech,politics,Robert Davis,analysis,politics,1491,23,1
239,2023-03-17,Business Business Crash Tech World,culture,Lisa Johnson,analysis,culture,1685,34,0
240,2025-11-19,Tech Discovery Election Politics,science,John Williams,feature,science,1679,32,0
241,2025-08-03,Giant Reveals Results Market Business Politics Breaking,business,Michael Davis,analysis,business,220,55,1
242,2024-01-09,New Change Business Breaking Business News New World,science,Jane Davis,news,science,1005,52,0
243,2023-11-19,Election Announces New World,culture,David Garcia,feature,culture,1616,28,0
244,2023-04-25,Reveals Business Results Reveals Politics Change Culture Breaking,tech,Emma Davis,analysis,tech,919,65,1
245,2025-04-29,Government Market Innovation Science Tech Science Climate Science,tech,Emma Rodriguez,news,tech,1270,65,0
246,2024-08-30,Results World Culture Business Results Giant Reveals,culture,Anna Rodriguez,analysis,culture,1043,52,0
247,2024-11-12,New Study Study Government Government,business,Emma Martinez,news,business,920,37,0
248,2025-07-26,New Business Tech Study News Change,tech,David Davis,opinion,tech,217,35,0
249,2024-02-01,Change New New Breaking,world,David Brown,opinion,world,1288,23,0
250,2025-09-15,Business Reveals Tech News Climate Market Crash Market,business,Anna Martinez,news,business,1338,54,1
251,2024-01-27,Climate News Climate New Results Climate,politics,John Davis,news,politics,948,40,0
