article_id,publish_date,title,section,author,format_type,topic,word_count,headline_length,paywalled
252,2024-08-15,Business Climate Announces,business,David Williams,analysis,business,1001,26,0
253,2025-01-13,Change New New Government,tech,Lisa Garcia,analysis,tech,253,25,0
254,2023-08-31,New Science Tech Reveals,tech,Jane Brown,feature,tech,718,24,0
255,2023-04-16,Change Science Announces World Business Discovery,science,Michael Martinez,news,science,1966,49,0
256,2023-01-11,Results Discovery Science Crash,science,Lisa Garcia,opinion,science,1161,31,0
257,2024-09-16,Politics Business Climate,world,Michael Brown,opinion,world,236,25,1
258,2024-01-21,Announces Announces Change Business Discovery Culture Announces Election,culture,Robert Garcia,feature,culture,990,72,1
259,2024-02-07,Study Business Culture Business Business Breaking,tech,Robert Davis,opinion,tech,734,49,0
260,2024-04-05,Reveals Change Culture Tech World,business,Sarah Smith,opinion,business,1215,33,0
261,2023-05-21,Announces Science Discovery Giant Breaking Discovery,politics,Anna Martinez,analysis,politics,1256,52,0
262,2023-01-31,Announces Market Study Discovery,science,Lisa Garcia,news,science,938,32,1
263,2023-04-04,Results Government Reveals Discovery Culture Results Discovery,tech,Sarah Miller,news,tech,207,62,0
264,2023-01-16,Science Politics Discovery,politics,Michael Williams,analysis,politics,1343,26,0
265,2023-06-27,Government New Giant Crash Innovation Discovery Giant Reveals,culture,Robert Rodriguez,news,culture,245,61,1
266,2023-06-26,Change Change Breaking Crash Reveals Announces,world,David Johnson,feature,world,876,46,0
267,2024-06-07,Tech Politics Results Breaking Study,business,Jane Jones,opinion,business,1133,36,1
268,2025-07-12,New Announces New Crash Science Politics Tech Reveals,culture,Jane Rodriguez,analysis,culture,998,53,1
269,2023-07-23,Business World Business Science,world,Jane Jones,opinion,world,603,31,0
270,2024-01-08,Tech Announces Study,world,Jane Jones,analysis,world,1310,20,0
271,2024-10-07,News Discovery New Crash Tech World Breaking News,world,Anna Williams,news,world,1413,49,1
272,2024-01-19,Election Innovation New Science Science Breaking,science,Michael Garcia,feature,science,840,48,0
273,2023-11-11,Results Tech Crash Breaking,tech,Jane Rodriguez,opinion,tech,1338,27,0
274,2023-09-16,Giant Election News Giant,world,Jane Jones,news,world,401,25,0
275,2024-05-08,Crash Business Government News Crash Results Announces,tech,Sarah Martinez,opinion,tech,416,54,0
276,2025-12-07,Reveals Breaking New Breaking Government Election Announces Climate,science,David Johnson,feature,science,551,67,0
277,2025-10-12,Politics Crash Election Politics Change Business Crash,tech,James Martinez,feature,tech,499,54,0
278,2023-01-10,Climate Reveals Politics Election Reveals Climate,world,Michael Garcia,news,world,942,49,1
279,2023-06-19,Politics Results Climate Discovery,science,John Jones,opinion,science,1125,34,0
280,2024-02-06,Market Giant News Study Results Science Discovery Breaking,world,John Miller,news,world,200,58,0
281,2023-04-18,Breaking Science Government Discovery Study,politics,Robert Miller,opinion,politics,1301,43,0
282,2023-01-08,Announces Politics News,world,Jane Rodriguez,analysis,world,1407,23,0
283,2024-09-17,Climate Change Market Government Breaking Science Results,politics,Lisa Johnson,opinion,politics,1698,57,1
284,2023-09-18,Market New Change Government Study Government,business,Anna Jones,opinion,business,1282,45,0
285,2024-06-24,Market Innovation Tech Breaking Change Business Election,world,Anna Garcia,news,world,1958,56,1
286,2023-11-22,Business Innovation Giant Study Culture Government,culture,Jane Martinez,feature,culture,684,50,0
287,2023-10-09,News Giant Discovery Government Discovery,culture,David Garcia,news,culture,1644,41,0
288,2023-07-23,Change Breaking Science Reveals Science,tech,Jane Garcia,analysis,tech,1183,39,1
289,2024-11-26,Government Giant World,world,David Garcia,news,world,857,22,0
290,2024-10-28,Science New Election,world,David Jones,feature,world,520,20,0
291,2025-09-16,Market Change Business,politics,Jane Smith,feature,politics,1771,22,0
292,2024-03-27,Reveals New Discovery Discovery Announces News,tech,Lisa Brown,analysis,tech,1435,46,0
293,2025-05-05,Science Business Election Politics Discovery,politics,David Miller,opinion,politics,1063,44,0
294,2024-09-13,Announces Government Results Innovation,business,John Jones,opinion,business,733,39,0
295,2024-10-07,Innovation Government Climate Innovation,politics,John Davis,news,politics,685,40,0
296,2025-11-25,Climate Election Change,tech,Robert Smith,opinion,tech,1618,23,0
297,2025-12-14,Change Innovation Giant,tech,John Miller,opinion,tech,495,23,0
298,2025-06-09,Politics Results Government Study Business Crash,world,John Davis,news,world,1142,48,0
299,2025-10-30,Giant Market Study New Election Change Discovery,culture,Michael Miller,opinion,culture,1644,48,0
300,2024-10-26,Science Study Reveals,business,Michael Martinez,opinion,business,1739,21,0
301,2025-03-03,Science Politics World Election,tech,Robert Martinez,feature,tech,1302,31,1
302,2024-04-07,Study Science Crash Politics Government Study Crash Politics,science,James Brown,opinion,science,968,60,0
303,2023-10-05,Breaking Climate Study Science Results,politics,Michael Brown,feature,politics,974,38,0
304,2023-08-29,Results Discovery Climate Climate Innovation Crash Study Announces,culture,Jane Johnson,opinion,culture,1010,66,0
305,2023-01-24,Election Breaking Innovation,tech,Emma Smith,news,tech,905,28,1
306,2024-11-09,News Election Government Discovery Politics Politics Announces,science,Robert Martinez,analysis,science,402,62,0
307,2023-02-06,Science Announces World Crash Discovery,tech,Sarah Jones,opinion,tech,334,39,0
308,2024-11-16,Discovery Study Crash Politics Politics,business,David Davis,feature,business,1661,39,0
309,2024-07-19,Science New Discovery Crash Government Climate World,world,Sarah Brown,analysis,world,325,52,0
310,2023-01-19,Business Change Science Business New,science,Emma Williams,news,science,1480,36,0
311,2024-01-13,Reveals Climate Innovation New Reveals Results Business Election,politics,Michael Miller,opinion,politics,345,64,0
312,2024-07-02,Giant Reveals Change Results,business,Anna Davis,opinion,business,1068,28,0
313,2023-02-17,Business Results Tech Change,world,Sarah Garcia,analysis,world,1479,28,0
314,2024-04-08,Announces Giant Crash,world,James Martinez,feature,world,1607,21,1
315,2024-01-28,Change Culture Innovation Election Crash,culture,Lisa Johnson,news,culture,1688,40,1
316,2024-10-31,Innovation Business Breaking News,science,Anna Williams,feature,science,846,33,0
317,2023-11-07,Politics Climate Giant Reveals Giant New,business,Jane Smith,opinion,business,1030,40,0
318,2023-07-08,Science Discovery Market Science,culture,Anna Rodriguez,news,culture,952,32,1
319,2023-02-07,Politics Giant New News Market,tech,Robert Rodriguez,analysis,tech,1867,30,1
320,2023-11-15,Study Politics Market Reveals Discovery Announces,culture,Lisa Johnson,opinion,culture,1554,49,0
321,2024-11-16,Politics World Market Change Government,politics,Michael Davis,opinion,politics,1002,39,0
322,2025-04-25,New Change Reveals Science Election,business,Michael Martinez,analysis,business,619,35,1
323,2023-04-30,Crash Reveals Breaking Crash,tech,Michael Rodriguez,feature,tech,1472,28,0
324,2024-12-12,Tech World Business New Reveals Politics Innovation World,culture,John Smith,feature,culture,1138,57,0
325,2024-03-16,Announces New Innovation Discovery Politics Study,business,Michael Garcia,feature,business,1879,49,1
326,2024-08-21,Election Breaking Change Culture,tech,Jane Brown,feature,tech,990,32,1
327,2023-03-13,Breaking Innovation Business Reveals New Change Breaking Breaking,politics,Emma Williams,news,politics,1400,65,1
328,2024-12-14,Announces Breaking Change Discovery Giant,science,Jane Smith,feature,science,1748,41,0
329,2024-11-07,News Crash Change World Reveals Election Results Results,tech,David Miller,opinion,tech,1237,56,0
330,2023-03-22,Government Discovery Innovation Culture Climate Breaking Business Change,tech,James Smith,analysis,tech,1297,72,0
331,2025-12-14,Science Business Tech,world,Sarah Smith,opinion,world,1970,21,0
332,2023-05-14,Election Election Science,world,David Williams,analysis,world,800,25,0
333,2024-02-28,News News Culture Tech Culture New Science Market,tech,John Garcia,news,tech,743,49,0
334,2025-01-25,Innovation New News Tech Discovery Innovation,science,Lisa Smith,opinion,science,1688,45,1
335,2023-01-06,Culture New Innovation,tech,Michael Martinez,news,tech,1713,22,0
336,2025-05-28,Announces Government World Giant Business Politics Science Market,culture,Michael Garcia,opinion,culture,333,65,1
337,2024-10-29,Crash Science New World,politics,Michael Miller,opinion,politics,720,23,0
338,2023-02-18,Election Election Election Giant Giant Giant Culture News,science,Jane Williams,opinion,science,1629,57,0
339,2023-07-12,Discovery Election News Breaking,politics,Michael Davis,opinion,politics,1233,32,0
340,2024-12-09,Breaking Science Government Politics Breaking Culture,politics,Emma Johnson,news,politics,1959,53,0
341,2024-04-03,Breaking Climate New Change,business,David Smith,analysis,business,344,27,1
342,2023-10-30,Science New Science Science Market Market Market,science,David Johnson,feature,science,1365,48,0
343,2025-06-16,Results Study Tech,business,Robert Smith,analysis,business,1299,18,0
344,2023-07-09,Discovery Study News Crash Crash News Crash,world,John Martinez,news,world,1860,43,0
345,2023-07-10,Climate Culture Discovery,science,Jane Martinez,feature,science,244,25,0
346,2024-03-21,News World Reveals World Results Study Crash,science,Lisa Jones,analysis,science,200,44,1
347,2023-04-29,News Market Crash Business Change Science Change Business,science,Sarah Davis,opinion,science,664,57,0
348,2025-12-18,Discovery Market Results,world,Lisa Jones,opinion,world,1003,24,0
349,2025-03-27,World Climate Change Science,business,Michael Martinez,feature,business,628,28,0
350,2023-03-02,Change New Tech New,tech,Robert Miller,opinion,tech,526,19,1
351,2023-04-25,Innovation Business Business Election Giant Crash Business,tech,Robert Smith,analysis,tech,1003,58,1
352,2025-07-18,New Discovery Business News Climate Climate Breaking New,culture,John Davis,news,culture,1108,56,0
353,2025-08-07,Tech Business Study Politics,business,Sarah Williams,analysis,business,601,28,1
354,2024-11-28,New Tech Tech Crash,world,Anna Williams,opinion,world,955,19,0
355,2025-09-09,Breaking Reveals Science Market Innovation,politics,John Davis,news,politics,582,42,0
356,2025-01-27,Election Giant News Results Reveals Study Politics Tech,tech,Michael Rodriguez,feature,tech,933,55,1
357,2025-09-19,Tech Innovation Crash Announces,world,Michael Jones,analysis,world,1035,31,0
358,2025-08-04,Announces Announces Tech Science Election,tech,James Williams,feature,tech,1043,41,0
359,2024-11-20,Reveals Election Science Reveals Politics Reveals Science Study,culture,Sarah Brown,opinion,culture,614,63,0
360,2023-09-08,Innovation Discovery New,tech,Michael Jones,news,tech,1477,24,1
361,2024-07-13,Science Election Breaking Market,world,Sarah Jones,news,world,934,32,1
362,2024-10-04,Science Study Science,world,John Brown,news,world,493,21,1
363,2024-06-28,Discovery Breaking New Reveals News Government,business,John Johnson,opinion,business,1969,46,1
364,2025-09-16,Study New Announces Science Change,politics,Emma Brown,opinion,politics,630,34,0
365,2023-06-11,Government Culture Government,culture,David Johnson,opinion,culture,1781,29,0
366,2024-07-29,Reveals Innovation Study Innovation Giant Innovation News New,politics,James Martinez,opinion,politics,427,61,0
367,2023-06-17,Announces Science New Business News,science,David Rodriguez,analysis,science,1156,35,0
368,2025-02-26,Crash Change Study New Tech,world,Sarah Smith,analysis,world,1778,27,1
369,2023-03-19,Election Results Business Giant Market Market Election,politics,Anna Miller,analysis,politics,1705,54,1
370,2024-10-26,World Crash Change Discovery Market World Breaking,science,John Martinez,news,science,1296,50,0
371,2024-03-20,Giant Study Discovery,science,Jane Johnson,news,science,1487,21,1
372,2025-09-21,Politics Breaking Reveals News,science,Anna Williams,news,science,1472,30,0
373,2023-04-05,New Government Government Culture,world,Anna Garcia,feature,world,647,33,0
374,2024-01-14,Crash Giant New Crash Reveals Results Announces Discovery,world,Emma Davis,analysis,world,1198,57,0
375,2023-08-09,Culture Breaking Science News Innovation Election,business,John Smith,news,business,723,49,0
376,2024-11-26,Politics Study Reveals Breaking,politics,Michael Johnson,opinion,politics,1075,31,0
377,2024-09-11,Politics World Discovery World Tech Giant Giant,science,John Brown,news,science,1807,47,1
378,2024-03-23,News World Science Crash Innovation Government,politics,David Smith,analysis,politics,707,46,0
379,2023-08-30,Change Innovation Culture,culture,Robert Garcia,news,culture,502,25,0
380,2025-07-15,World Reveals Innovation World Business Climate World,world,David Garcia,feature,world,492,53,0
381,2025-03-24,Breaking Announces World,world,Lisa Martinez,news,world,1092,24,0
382,2025-07-14,Study Business Culture,world,John Brown,opinion,world,1036,22,0
383,2024-02-11,Government Reveals Announces Discovery Reveals Change Market World,business,Michael Brown,news,business,890,66,0
384,2023-08-17,World Giant Tech Culture Study,science,Jane Garcia,news,science,1104,30,0
385,2025-02-23,Crash Business Change Innovation,politics,John Williams,opinion,politics,1233,32,1
386,2024-11-29,Culture Results Innovation Results Tech Results,politics,Sarah Miller,analysis,politics,1127,47,0
387,2025-11-12,Election Culture Crash Results,science,David Smith,feature,science,501,30,0
388,2023-08-06,Business Business News Politics World,tech,Anna Miller,news,tech,1012,37,0
389,2024-10-09,Culture Study Business,science,Jane Rodriguez,analysis,science,458,22,1
390,2023-03-20,Election Announces Innovation,tech,David Williams,news,tech,1157,29,1
391,2023-08-25,Politics Giant News Results,science,James Davis,news,science,1192,27,0
392,2024-08-01,Tech Business Science Business,politics,Emma Garcia,news,politics,499,30,0
393,2025-07-17,Crash Crash Tech Study New Announces Results Science,science,Robert Johnson,feature,science,536,52,0
394,2024-02-26,News Business Breaking,business,David Williams,opinion,business,1305,22,0
395,2024-05-07,Announces Tech Science,world,John Rodriguez,news,world,1412,22,1
396,2024-12-30,World Business Change World Government Market,tech,David Davis,analysis,tech,1552,45,0
397,2023-07-28,Crash Crash New,science,John Martinez,news,science,1481,15,0
398,2024-08-21,Change Climate Change Change Change Giant,science,James Smith,analysis,science,323,41,1
399,2025-05-26,Politics Climate Tech,tech,Emma Johnson,analysis,tech,547,21,0
400,2023-12-24,Reveals Giant Reveals Reveals Market,culture,Emma Smith,analysis,culture,1354,36,1
401,2025-11-30,Giant Business Announces,politics,David Martinez,news,politics,488,24,0
402,2025-06-22,Crash Government Breaking Study Giant,politics,Michael Jones,feature,politics,1059,37,1
403,2025-04-27,Giant Announces Discovery,politics,Jane Williams,news,politics,927,25,0
404,2025-06-04,New News Market Discovery Market Giant Breaking,politics,Lisa Jones,news,politics,1835,47,0
405,2024-03-25,Breaking New Market Discovery Market Study Politics Culture,culture,David Williams,news,culture,1705,59,0
406,2024-01-31,Science Science Study,tech,Jane Davis,opinion,tech,1444,21,0
407,2024-09-30,Election Reveals World Business Science Crash Market News,politics,James Brown,analysis,politics,680,57,0
408,2023-02-10,Giant Study Announces New Politics Election,politics,James Davis,analysis,politics,972,43,0
409,2023-07-20,World Politics New World Tech News,world,Robert Brown,feature,world,1520,34,0
410,2023-02-21,Market Results Market Breaking Announces Announces,business,Michael Garcia,opinion,business,201,50,0
411,2023-03-08,Climate Reveals Breaking Innovation Discovery Culture,politics,David Davis,news,politics,718,53,1
412,2024-11-10,News Market News Government Election,tech,Emma Williams,feature,tech,1888,36,1
413,2024-07-30,Discovery News Change Results,culture,Lisa Garcia,opinion,culture,1971,29,0
414,2024-04-01,Innovation Results Culture Study Reveals Giant Government,world,Emma Williams,analysis,world,1666,57,0
415,2025-10-11,Breaking Reveals Politics,science,Sarah Davis,analysis,science,463,25,0
416,2025-11-09,Results Science Climate New,politics,Jane Martinez,news,politics,927,27,0
417,2023-05-04,Study Government News Breaking Tech Climate,tech,Michael Garcia,opinion,tech,1993,43,1
418,2024-08-14,World Crash Politics News Announces Business Election Science,science,John Brown,opinion,science,1413,61,0
419,2025-01-09,Climate Government Change Science Reveals Business,business,Robert Jones,news,business,1581,50,0
420,2023-02-14,Science Election World Announces Study,world,David Smith,opinion,world,638,38,0
421,2023-04-01,New Culture Study,world,Michael Garcia,opinion,world,777,17,0
422,2024-10-14,Change Science Market Politics Business,world,Anna Rodriguez,news,world,514,39,1
423,2024-08-28,Innovation New Study Tech Tech Business,tech,Lisa Jones,opinion,tech,1407,39,0
424,2023-05-07,Government Crash Business,tech,Emma Williams,opinion,tech,377,25,0
425,2025-10-28,Business Study World Reveals Politics Discovery Results,tech,Robert Jones,feature,tech,1168,55,0
426,2025-04-18,Culture Election Politics Election Politics News Study Change,politics,Emma Garcia,news,politics,1505,61,0
427,2024-08-17,Crash Innovation Business New Change Change,world,Anna Williams,news,world,561,43,0
428,2025-01-16,Election Results Government Government,business,David Brown,feature,business,1890,38,0
429,2024-05-13,Study Election World,science,Emma Martinez,news,science,587,20,0
430,2024-08-21,Politics Market Results Crash World Change World Government,world,Anna Johnson,analysis,world,428,59,0
431,2025-07-19,Change News Announces Climate,business,Anna Martinez,opinion,business,1030,29,0
432,2025-06-20,Announces Discovery Breaking Business Results Change Discovery,culture,Michael Williams,analysis,culture,1717,62,0
433,2023-03-12,Market Culture Culture,world,Lisa Martinez,feature,world,1987,22,1
434,2023-03-22,News New Market Results Market,world,Anna Johnson,analysis,world,519,30,0
435,2025-02-14,Announces Market Business Innovation Study Announces,science,Sarah Johnson,opinion,science,785,52,0
436,2025-05-25,Results World Reveals News Giant Announces Change,world,John Rodriguez,news,world,992,49,0
437,2025-06-14,Election News Climate Study Business,world,Sarah Davis,opinion,world,996,36,1
438,2025-09-23,Tech Politics Innovation Discovery New Election,world,Anna Garcia,analysis,world,1881,47,0
439,2023-09-27,Discovery Study Giant,science,Jane Garcia,feature,science,1737,21,0
440,2023-05-17,Discovery New Results New,world,James Williams,news,world,958,25,0
441,2024-11-03,Climate Crash Government Tech Reveals,business,James Williams,news,business,1617,37,0
442,2024-09-19,Change Culture Announces Innovation Study,tech,Emma Davis,analysis,tech,853,41,0
443,2025-12-05,Study Reveals Culture,politics,Robert Johnson,opinion,politics,1748,21,0
444,2023-03-05,Giant Results Giant Market Giant Discovery Tech,politics,Lisa Smith,feature,politics,1888,47,1
445,2024-06-14,Reveals Reveals Climate Business Crash New Innovation,business,John Davis,feature,business,247,53,0
446,2023-08-17,Study Breaking Results Climate Reveals Climate,culture,Sarah Rodriguez,feature,culture,1761,46,1
447,2025-04-15,Business Politics Climate,world,Emma Smith,news,world,1534,25,1
448,2024-08-24,Culture Study Giant Results Reveals,world,Anna Miller,news,world,573,35,1
449,2023-11-27,Market Tech Politics News,tech,Lisa Johnson,feature,tech,652,25,0
450,2025-06-19,Culture Innovation World Election Reveals,business,Lisa Garcia,feature,business,930,41,0
451,2024-05-16,Study Government Study Study Crash Results Culture,world,Sarah Martinez,news,world,911,50,0
452,2023-10-18,Reveals News Election,science,John Martinez,feature,science,1583,21,1
453,2025-01-12,Change Giant New Market Breaking Change World,science,Emma Martinez,opinion,science,1187,45,0
454,2025-04-08,Market Crash Election Innovation Business Climate,business,John Garcia,feature,business,362,49,0
455,2025-07-07,Science News Market Announces,business,Lisa Johnson,opinion,business,746,29,1
456,2024-12-29,Climate Giant New,politics,Emma Brown,news,politics,1791,17,0
457,2023-03-10,Breaking Results Government Announces Science Politics Climate Breaking,culture,Lisa Garcia,feature,culture,1093,71,0
458,2024-05-18,New Science Change Breaking,culture,Michael Rodriguez,opinion,culture,1921,27,0
459,2025-10-22,Announces Announces New Giant Innovation Giant Discovery,politics,John Rodriguez,analysis,politics,1735,56,0
460,2025-06-04,Election Breaking Breaking Market Science Breaking,politics,John Brown,opinion,politics,641,50,0
461,2025-02-24,New Culture Science Breaking Politics Reveals News,world,Jane Garcia,feature,world,1500,50,0
462,2025-05-04,News Crash Science Reveals News Change,politics,James Garcia,feature,politics,1056,38,0
463,2024-01-09,Crash Breaking World Reveals,science,John Rodriguez,news,science,421,28,0
464,2025-12-31,Discovery Business News New Crash Breaking Announces Reveals,politics,Michael Davis,opinion,politics,1599,60,0
465,2024-03-24,Crash Election Market Business Breaking,world,Emma Johnson,feature,world,414,39,0
466,2025-06-06,Politics Government New News Results Culture World Announces,tech,David Smith,analysis,tech,573,60,1
467,2025-08-28,Tech Crash Breaking Politics Change Climate Announces,politics,Anna Smith,analysis,politics,394,53,0
468,2023-12-01,Culture New Culture Giant,science,Anna Martinez,news,science,726,25,0
469,2025-08-10,New Giant Breaking Change Discovery Announces Tech Change,world,Emma Miller,feature,world,1924,57,1
470,2025-12-15,Innovation News Business Market Change,tech,Lisa Smith,analysis,tech,1272,38,0
471,2024-09-09,New Study News World Politics,business,James Garcia,news,business,458,29,0
472,2023-09-28,Reveals Government Business,world,Lisa Garcia,analysis,world,474,27,1
473,2023-07-26,Crash Results Business Business Breaking Results Innovation,business,Emma Davis,analysis,business,936,59,1
474,2024-03-11,Giant Politics Giant,business,Anna Williams,opinion,business,816,20,0
475,2025-05-25,Culture Discovery Breaking,science,Emma Jones,opinion,science,1506,26,0
476,2025-09-27,Business Market Business,science,Michael Brown,analysis,science,1499,24,0
477,2024-08-23,Culture Tech Government World Business,tech,James Brown,analysis,tech,1715,38,1
478,2024-01-22,Announces Crash Government Crash Innovation Science Crash,world,Michael Brown,analysis,world,895,57,0
479,2025-12-27,Tech Culture Results News,science,Sarah Williams,feature,science,680,25,1
480,2025-01-13,Market Giant Study,science,Emma Davis,feature,science,1591,18,0
481,2024-07-18,Crash Crash Business,politics,Robert Martinez,feature,politics,518,20,0
482,2025-03-02,Reveals Election Market,science,Anna Miller,opinion,science,1637,23,0
483,2025-01-11,Announces Discovery Science Government,business,Anna Johnson,feature,business,1558,38,0
484,2025-04-15,Tech Government Reveals Discovery World Discovery,politics,James Johnson,analysis,politics,1926,49,0
485,2024-06-06,New Innovation Crash Business Results Discovery Results,tech,Robert Garcia,analysis,tech,464,55,0
486,2024-08-08,Business Market Discovery Innovation World Discovery Breaking,culture,Anna Brown,analysis,culture,1489,61,1
487,2023-09-13,Crash News Results Election Giant New Government Politics,world,Emma Williams,opinion,world,895,57,0
488,2025-06-19,Business Culture News,tech,Anna Rodriguez,feature,tech,1732,21,1
489,2023-03-29,New Change Climate Discovery Breaking Market Giant Breaking,science,Lisa Davis,analysis,science,1065,59,1
490,2023-01-11,Politics Giant Reveals Culture Study Giant,business,Sarah Williams,feature,business,1108,42,0
491,2024-08-08,Announces Business World,politics,John Johnson,feature,politics,1241,24,0
492,2024-04-07,Breaking Market Tech Change Market Reveals World Reveals,business,Robert Rodriguez,news,business,635,56,0
493,2024-11-30,Science Innovation Breaking Government Politics New,politics,Emma Smith,news,politics,1286,51,1
494,2025-04-21,Science Government Politics Business Culture Market Crash Reveals,politics,Michael Jones,opinion,politics,380,65,0
495,2024-11-15,Election Results Tech Breaking,politics,Robert Davis,opinion,politics,1074,30,0
496,2023-10-07,Crash Announces News Politics Politics Government Reveals,science,Robert Garcia,feature,science,931,57,0
497,2025-03-13,Reveals Culture Crash Breaking Culture Innovation Business,politics,Michael Rodriguez,analysis,politics,1761,58,0
498,2023-08-30,Discovery Crash Business Politics Climate Innovation Election Discovery,science,Sarah Miller,opinion,science,1947,71,1
499,2025-02-16,Election Market Science Culture Announces Crash Breaking Breaking,politics,Lisa Brown,opinion,politics,1159,65,0
500,2025-12-23,Climate Politics Change Innovation Tech Crash,tech,David Williams,opinion,tech,1067,45,0
501,2023-06-21,Election Announces Business,science,Emma Miller,opinion,science,1164,27,0
502,2023-06-09,Tech Discovery Climate,world,James Miller,analysis,world,1177,22,0
503,2024-04-12,Results Election New Government Climate Giant,politics,John Davis,news,politics,1155,45,1
504,2025-07-17,Business Climate Market Breaking New Culture,politics,Sarah Johnson,opinion,politics,1223,44,0
505,2025-01-10,Giant Business Reveals Change,culture,Anna Martinez,opinion,culture,1485,29,0
506,2023-12-31,Study Giant News,world,John Miller,opinion,world,889,16,0
507,2024-08-13,Giant Crash Tech Culture,culture,Michael Martinez,feature,culture,1800,24,1
508,2025-04-13,Discovery New News Election Results Politics Market Government,tech,Anna Smith,analysis,tech,1893,62,1
