article_id,publish_date,title,section,author,format_type,topic,word_count,headline_length,paywalled
758,2025-12-31,Breaking Study World Business World Business Government Announces,tech,Sarah Martinez,opinion,tech,1177,65,0
759,2025-02-20,Giant Election New Government Crash Crash Results,tech,Sarah Williams,opinion,tech,1221,49,0
760,2024-03-07,Announces Discovery Giant Culture Results Discovery,science,John Miller,feature,science,1577,51,0
761,2023-01-26,World Breaking Government Change Study Culture Government Market,tech,Lisa Brown,news,tech,1773,64,1
762,2025-12-05,Giant Change Crash World Science Politics,tech,John Rodriguez,news,tech,1269,41,0
763,2024-12-03,Innovation Breaking Culture Science,politics,Anna Davis,opinion,politics,1360,35,0
764,2023-09-13,Government Announces Discovery,business,Sarah Martinez,opinion,business,1003,30,0
765,2023-02-08,Government Science Culture Business New,politics,David Miller,opinion,politics,1963,39,0
766,2023-11-23,Business Innovation Election Government,science,Lisa Miller,news,science,691,39,0
767,2023-02-14,Study World Giant News Culture Announces,business,David Johnson,news,business,982,40,0
768,2023-11-28,Politics Culture Giant Innovation Innovation,business,James Brown,news,business,1227,44,0
769,2025-04-07,Crash Market Reveals Business Breaking,world,Robert Jones,analysis,world,318,38,1
770,2025-05-06,Change Science New Climate Giant Tech Politics Climate,culture,Michael Miller,news,culture,789,54,0
771,2024-02-05,World World Government Innovation,science,Jane Martinez,analysis,science,1698,33,0
772,2023-06-08,Announces World Market Innovation Reveals Breaking Government,politics,James Brown,news,politics,953,61,0
773,2025-04-27,Tech Culture Business Innovation Giant Science,politics,Emma Johnson,opinion,politics,697,46,0
774,2025-04-07,Breaking Tech News Science,world,James Davis,feature,world,385,26,0
775,2024-08-06,Culture Crash Results Politics,science,Michael Williams,news,science,1025,30,0
776,2025-04-10,News Science Science World,world,Sarah Martinez,feature,world,1213,26,0
777,2023-07-21,Culture Innovation Culture Reveals Discovery Market,world,James Williams,analysis,world,1773,51,1
778,2025-07-25,Results Discovery Science,world,Emma Williams,analysis,world,1639,25,0
779,2024-03-05,Business Culture Change News,tech,Jane Davis,opinion,tech,1106,28,0
780,2023-03-24,Science Election Culture Innovation Discovery Giant Change New,culture,Jane Smith,opinion,culture,1293,62,1
781,2023-05-24,Crash Breaking Market Study Discovery Climate,science,Lisa Johnson,feature,science,862,45,0
782,2025-10-26,Culture Culture Science Announces Reveals Politics Culture,tech,Sarah Garcia,analysis,tech,365,58,0
783,2025-02-02,Breaking Results Discovery Culture Discovery Announces Results News,politics,David Davis,news,politics,284,67,0
784,2023-03-30,Election Climate Breaking Government,world,James Brown,analysis,world,1430,36,0
785,2025-05-06,Government Innovation Change World,business,Robert Davis,news,business,1299,34,0
786,2025-06-05,Tech News Results Change,world,Emma Martinez,analysis,world,310,24,1
787,2025-01-25,Market Culture Crash Science Crash Breaking,politics,Jane Davis,opinion,politics,530,43,0
788,2025-10-25,World Tech Election Business Innovation Giant Breaking,culture,David Martinez,opinion,culture,915,54,0
789,2023-05-22,Results Reveals Innovation Giant Discovery News Culture Giant,politics,Michael Johnson,feature,politics,624,61,0
790,2025-05-18,Change Change Study Politics,science,Michael Rodriguez,opinion,science,1587,28,1
791,2023-01-04,Crash Culture Discovery Market Change Climate Politics Breaking,science,John Smith,opinion,science,1871,63,0
792,2023-02-04,Reveals New Breaking,business,James Martinez,analysis,business,993,20,0
793,2025-02-16,Discovery News Breaking World Giant Change World,world,Michael Brown,feature,world,1953,48,0
794,2024-06-07,World Politics Tech Science,business,James Garcia,opinion,business,1098,27,0
795,2023-07-23,Giant World Announces Politics Government,world,David Miller,analysis,world,1434,41,0
796,2025-08-13,Giant World Change Culture Election Discovery New,world,James Brown,opinion,world,1874,49,0
797,2023-02-14,Giant Announces Science Politics Study Climate,business,Jane Johnson,analysis,business,695,46,1
798,2023-09-21,Culture Giant Discovery World Giant Government Culture,culture,David Jones,opinion,culture,580,54,0
799,2025-07-01,Innovation Government Announces Election Crash Government,science,Robert Jones,analysis,science,280,57,0
800,2025-06-19,Results Science Science Results Reveals Market Climate Change,politics,Anna Jones,analysis,politics,1039,61,0
801,2023-12-24,Change Crash Climate,politics,Sarah Garcia,analysis,politics,356,20,0
802,2025-11-21,Reveals Election Giant Crash,business,Robert Smith,analysis,business,1813,28,0
803,2023-09-15,New Announces Change Market,business,Lisa Brown,feature,business,1825,27,0
804,2025-06-05,Announces Breaking Innovation Study Business Crash Crash Tech,science,Lisa Jones,opinion,science,1270,61,0
805,2025-03-27,Climate Discovery Giant,world,Sarah Johnson,analysis,world,1985,23,0
806,2025-03-29,Crash Science Science Giant Study New Change,culture,James Jones,news,culture,591,44,1
807,2025-07-02,Crash News Announces New Breaking,tech,Emma Williams,opinion,tech,1089,33,0
808,2025-07-10,Reveals Science Study New News Results,politics,Lisa Johnson,opinion,politics,1219,38,0
809,2025-03-08,Government Government Science Culture,science,David Brown,analysis,science,1410,37,0
810,2023-03-10,Change Study Business World Results Discovery,world,James Jones,feature,world,247,45,0
811,2024-04-21,World Giant Science News Innovation Election Innovation,culture,Jane Johnson,analysis,culture,1592,55,1
812,2024-06-07,Announces Reveals Announces Market Study Tech Reveals,world,Jane Williams,analysis,world,1492,53,0
813,2023-11-08,Politics Announces Culture Business Science,politics,Emma Garcia,analysis,politics,1493,43,0
814,2023-01-01,Change Innovation Announces Discovery Innovation,business,Michael Jones,feature,business,1515,48,0
815,2025-05-11,Results Announces Discovery,politics,David Davis,opinion,politics,1712,27,1
816,2024-05-12,New Breaking Culture,science,John Williams,analysis,science,688,20,0
817,2025-12-11,News Climate New Study Breaking,culture,Michael Rodriguez,feature,culture,1249,31,1
818,2025-12-08,Giant Climate Politics Election Study,business,James Miller,feature,business,1538,37,0
819,2024-04-23,Politics Market Innovation Change,culture,Emma Garcia,feature,culture,1253,33,0
820,2023-03-10,Market Crash Science Tech Innovation Reveals Breaking Government,tech,John Martinez,analysis,tech,998,64,1
821,2025-10-01,Market Breaking Market Politics,world,Michael Smith,news,world,1171,31,0
822,2024-01-29,Culture Discovery Business Politics Breaking,business,David Jones,opinion,business,904,44,0
823,2023-08-09,Reveals Change Reveals Discovery Giant,tech,Emma Miller,news,tech,1212,38,1
824,2025-09-16,Reveals Innovation Study Market Discovery Discovery Tech New,science,Robert Jones,opinion,science,684,60,1
825,2024-12-05,Science Culture Study Announces Reveals,business,James Martinez,feature,business,1753,39,0
826,2023-10-30,Discovery Election Giant World Market Results Science,tech,Jane Jones,news,tech,1840,53,0
827,2023-05-22,Culture New Breaking Breaking Government Study,tech,Lisa Williams,feature,tech,724,46,0
828,2023-03-12,Breaking Breaking Market News Crash,business,Anna Brown,opinion,business,1472,35,0
829,2024-12-03,Discovery New Culture Giant Tech Tech,tech,Emma Davis,feature,tech,1095,37,0
830,2024-02-07,Science Announces Announces Crash Breaking Results Results,tech,David Johnson,feature,tech,1910,58,0
831,2025-09-04,Discovery Innovation World Market Breaking Election New Change,business,Sarah Garcia,news,business,1264,62,0
832,2024-03-10,Business Breaking Election Tech News Market Giant Study,business,Jane Brown,news,business,292,55,1
833,2024-12-03,World Government Election Government World New Market,business,Emma Williams,analysis,business,582,53,0
834,2023-06-14,News Climate Climate Breaking,world,Robert Garcia,opinion,world,1967,29,0
835,2024-01-01,Election Climate New Government Climate Reveals,tech,James Smith,analysis,tech,462,47,0
836,2025-11-07,New Tech Innovation Discovery Market Business,politics,Sarah Brown,opinion,politics,827,45,0
837,2023-11-17,Market World Results Discovery Culture Science Science Climate,politics,Sarah Johnson,news,politics,1806,62,0
838,2025-03-17,Business Reveals Politics World World Innovation Reveals Innovation,business,Michael Williams,feature,business,757,67,0
839,2025-02-21,Discovery Business Study Climate Market Government Reveals,business,John Rodriguez,opinion,business,281,58,1
840,2025-10-01,Science Reveals Climate,tech,Anna Jones,feature,tech,1370,23,0
841,2025-05-14,Crash Discovery Climate Discovery Discovery Tech,culture,John Rodriguez,feature,culture,1383,48,0
842,2025-04-07,Announces Science Giant Announces Tech Results,world,Lisa Rodriguez,feature,world,1625,46,1
843,2025-07-18,Reveals Business Breaking Innovation New Innovation Government,business,David Martinez,feature,business,1143,62,0
844,2023-12-12,World Discovery Innovation Climate Discovery,tech,Sarah Garcia,feature,tech,1906,44,1
845,2024-06-13,Market Reveals Breaking News,world,Robert Rodriguez,feature,world,1968,28,1
846,2025-08-13,World Breaking Business Tech World,politics,Jane Williams,news,politics,1722,34,0
847,2023-02-04,Business Market Science World,business,Jane Garcia,news,business,1777,29,0
848,2023-07-17,Breaking Reveals Reveals Politics,world,David Williams,analysis,world,668,33,0
849,2025-09-15,Tech Announces Reveals Election Politics Politics,tech,Jane Rodriguez,feature,tech,1987,49,0
850,2023-02-23,Discovery Discovery Politics World Announces Election,politics,John Smith,opinion,politics,462,53,0
851,2025-02-02,Politics New News Climate Climate Market,politics,Robert Rodriguez,feature,politics,378,40,1
852,2023-03-14,Change New Study,science,John Rodriguez,analysis,science,699,16,1
853,2025-11-09,World Innovation Politics Tech Politics Study Crash,business,Jane Davis,feature,business,970,51,0
854,2025-09-16,Discovery Reveals News Study Climate Market Change Breaking,tech,Lisa Williams,analysis,tech,512,59,0
855,2023-04-24,New World Government Change Business Government Announces,science,John Martinez,opinion,science,998,57,0
856,2024-11-11,Reveals Tech Government Election Business Business Politics,culture,Jane Rodriguez,opinion,culture,237,59,0
857,2024-02-02,Study Culture Climate Market,world,James Rodriguez,analysis,world,513,28,0
858,2025-08-13,Announces Reveals Culture Government Innovation Breaking News Breaking,culture,Anna Martinez,news,culture,1286,70,0
859,2023-01-20,Breaking Tech Government Change Study Climate News,tech,Jane Williams,analysis,tech,1029,50,1
860,2024-04-09,Study Climate Announces Crash Discovery,tech,Lisa Miller,feature,tech,1402,39,1
861,2025-09-30,Reveals News Change Election Culture New Results Climate,culture,Anna Smith,opinion,culture,488,56,0
862,2025-05-06,Breaking News Climate Science,politics,James Jones,news,politics,435,29,0
863,2023-09-26,Market Discovery Politics Climate,science,David Jones,news,science,1656,33,0
864,2025-04-14,Study Science Politics Innovation Breaking Giant Crash New,business,James Williams,analysis,business,628,58,0
865,2024-05-06,Culture News Study Culture,tech,Emma Martinez,news,tech,327,26,0
866,2025-11-08,News Announces Study New Politics,tech,David Garcia,feature,tech,1695,33,1
867,2025-10-31,Market Study Science Climate Reveals Crash,culture,Michael Miller,news,culture,1386,42,0
868,2025-12-22,Study Results Culture Election,politics,Michael Brown,news,politics,1535,30,0
869,2024-02-10,Discovery Announces Innovation Business Giant New Politics Results,business,James Garcia,feature,business,1063,66,0
870,2023-06-04,Election Science Culture Discovery Business Study World,politics,Anna Garcia,feature,politics,1532,55,1
871,2023-09-15,Change Market Crash Culture,science,Jane Smith,news,science,560,27,1
872,2024-01-25,Science Reveals Politics Change Crash Results Announces Study,politics,Robert Rodriguez,analysis,politics,264,61,1
873,2023-08-16,Innovation New Giant Tech Science Politics New Market,politics,Robert Martinez,opinion,politics,493,53,0
874,2025-04-02,Discovery Announces News Announces Breaking Discovery Election,politics,Lisa Williams,feature,politics,1391,62,1
875,2024-05-20,Business Breaking Innovation Innovation Culture Study News,tech,Robert Davis,analysis,tech,1650,58,0
876,2023-02-17,Breaking Market Crash Discovery Market Election Culture,world,Robert Rodriguez,opinion,world,615,55,0
877,2024-10-29,Culture Innovation Innovation Discovery Reveals,tech,John Smith,news,tech,452,47,0
878,2025-03-07,Crash Climate Study Results Election Change,culture,James Johnson,feature,culture,967,43,1
879,2023-07-15,Innovation Election New Discovery Election News,politics,Sarah Brown,opinion,politics,1548,47,1
880,2024-11-11,Results Election World Giant News Crash Breaking Government,business,Michael Rodriguez,news,business,1100,59,0
881,2024-01-24,Reveals News News Election Culture Climate News Innovation,science,Jane Williams,news,science,1685,58,0
882,2023-09-08,Giant News Culture,world,Sarah Johnson,feature,world,1632,18,1
883,2025-10-13,Election Announces Results Market Climate Discovery World,tech,David Williams,news,tech,580,57,0
884,2023-12-05,Crash Climate New New News Reveals,science,Robert Rodriguez,analysis,science,1694,34,0
885,2024-07-25,Innovation Reveals Government Climate Crash Tech Tech Science,business,David Rodriguez,analysis,business,765,61,0
886,2023-01-17,News New Culture Culture Breaking Breaking Results Results,business,Lisa Brown,analysis,business,827,58,0
887,2024-07-06,New Discovery Breaking Change,world,Robert Davis,feature,world,1499,29,0
888,2023-08-27,News Politics Change Climate Culture Market,science,David Johnson,feature,science,805,43,1
889,2023-11-28,World World Crash Climate World Election,business,Sarah Smith,opinion,business,1270,40,0
890,2024-05-24,Giant World New Discovery News Announces,science,Jane Brown,feature,science,1144,40,0
891,2025-12-11,Election News Tech Climate Breaking,politics,Sarah Williams,analysis,politics,1840,35,1
892,2024-12-11,Innovation Breaking Change New Discovery Culture Reveals Climate,world,John Miller,opinion,world,1676,64,0
893,2023-09-24,Giant Giant Politics Change Reveals Tech Giant,business,Anna Smith,feature,business,818,46,1
894,2023-07-20,Innovation News Giant Culture Breaking,tech,John Garcia,opinion,tech,638,38,1
895,2025-10-02,Politics Science Election Reveals Giant Results Climate,culture,James Davis,analysis,culture,857,55,1
896,2024-10-12,Breaking Announces Politics Culture Science,politics,Lisa Williams,feature,politics,570,43,0
897,2024-06-28,Study World Study Government Science Breaking,politics,John Johnson,feature,politics,1431,45,0
898,2024-09-08,Election Science Study Election Tech Giant Business,science,Emma Johnson,opinion,science,442,51,1
899,2023-01-17,Crash Reveals World Breaking,politics,Robert Jones,opinion,politics,1708,28,0
900,2023-04-12,Market Discovery Climate Business,science,James Brown,news,science,1898,33,0
901,2023-03-12,Business World Election Crash Change,science,James Johnson,analysis,science,1586,36,1
902,2023-03-21,Government Giant Culture World Science Climate,science,Lisa Johnson,news,science,1950,46,1
903,2024-10-04,Change Study Election New Government,business,David Miller,feature,business,1168,36,1
904,2024-06-16,Innovation Giant Discovery Science Discovery Announces Culture World,business,Jane Johnson,feature,business,1265,68,0
905,2025-04-09,Reveals Science News Giant Innovation,tech,Michael Davis,feature,tech,1436,37,1
906,2024-11-04,Results News Crash Business Change Election Reveals Science,tech,Lisa Jones,feature,tech,1777,59,0
907,2025-11-17,Climate Discovery Market Culture,politics,Sarah Jones,analysis,politics,710,32,1
908,2024-02-24,Discovery Reveals Announces Market Climate New,business,James Garcia,analysis,business,1131,46,0
909,2023-06-03,Giant Study Announces Change World Change Tech Culture,world,Robert Rodriguez,opinion,world,859,54,0
910,2023-03-31,Culture Breaking Culture,science,David Garcia,analysis,science,1039,24,1
911,2024-01-11,Election News Breaking Announces,science,Emma Miller,analysis,science,718,32,0
912,2024-09-24,Crash Study Science Announces,business,Anna Davis,analysis,business,605,29,0
913,2024-08-28,Announces Market News Giant World New Innovation Reveals,science,Michael Martinez,news,science,1061,56,0
914,2023-01-12,Politics Business Innovation World Science Discovery Politics Announces,world,David Rodriguez,opinion,world,887,71,1
915,2024-05-06,Change Science Election Government Breaking Change Tech Government,science,James Rodriguez,analysis,science,1469,66,0
916,2025-08-17,Election Culture Giant Results Results World Business New,politics,Michael Garcia,feature,politics,1665,57,0
917,2024-06-28,Breaking News Reveals Change,tech,Emma Rodriguez,analysis,tech,789,28,0
918,2023-06-01,Market Government World Science Market World Market,world,James Smith,opinion,world,594,51,1
919,2023-01-09,Culture News Tech Announces,science,Robert Williams,feature,science,382,27,0
920,2023-12-18,Breaking Discovery Giant Breaking Breaking Politics Business,tech,Michael Martinez,news,tech,507,60,1
921,2024-12-06,Election Market Government Discovery Giant Tech Study New,world,Emma Davis,opinion,world,1025,57,0
922,2024-01-19,News Culture Politics Results News Climate,business,David Brown,feature,business,1763,42,1
923,2023-10-14,Culture Results World Study Discovery Politics Giant,culture,James Jones,opinion,culture,219,52,0
924,2023-03-01,Change Science Giant Science,world,James Martinez,feature,world,1793,28,0
925,2024-01-09,Innovation News Climate Science Change Discovery Breaking,politics,Sarah Smith,opinion,politics,689,57,1
926,2025-01-06,Election Giant Tech Climate Election Breaking Science,world,Michael Johnson,analysis,world,511,53,1
927,2024-02-11,Breaking Business Science Study Business Tech Breaking,science,James Jones,opinion,science,269,54,0
928,2024-10-20,Tech Business Crash Market Climate World,politics,John Davis,opinion,politics,1949,40,1
929,2024-08-30,Breaking Announces Announces News Business Culture Climate Results,world,Robert Martinez,opinion,world,1150,66,0
930,2025-07-03,Breaking Culture Business Announces Business Announces News,culture,Jane Miller,feature,culture,1119,59,1
931,2023-05-12,Announces World Change Government,politics,Robert Davis,feature,politics,607,33,0
932,2023-06-12,Science Culture Tech Results,science,Robert Williams,feature,science,430,28,0
933,2025-07-13,Science New Innovation Giant Crash Innovation Innovation,world,Sarah Davis,news,world,1257,56,0
934,2024-04-28,Politics Innovation New New Giant,politics,Lisa Davis,feature,politics,819,33,1
935,2023-08-18,Study Innovation Giant Politics New Politics News,politics,John Smith,feature,politics,1467,49,0
936,2023-11-19,Tech Change Study,politics,Michael Miller,news,politics,651,17,0
937,2023-08-01,Market Announces World News Change Crash Science,science,David Williams,news,science,1498,48,0
938,2023-11-05,Breaking Breaking Election,science,Emma Rodriguez,opinion,science,330,26,0
939,2024-04-11,Crash Tech Government Culture Giant Change,culture,James Williams,analysis,culture,1799,42,0
940,2024-05-06,Reveals Market Tech Announces Breaking Innovation,culture,Emma Johnson,analysis,culture,863,49,0
941,2023-05-25,Reveals Crash Science Innovation Government Business Study Discovery,tech,Lisa Martinez,news,tech,610,68,0
942,2023-09-13,Announces Innovation Election Culture Culture Politics Market Science,tech,Emma Davis,feature,tech,1990,69,0
943,2023-04-08,Announces Market Reveals Culture,business,Michael Davis,feature,business,1869,32,0
944,2023-06-10,Innovation Science Study Reveals Business Tech,politics,David Smith,analysis,politics,1275,46,1
945,2024-11-04,Politics World Crash,culture,Anna Jones,feature,culture,1703,20,0
946,2023-05-18,Business Results Culture,business,Jane Garcia,analysis,business,926,24,0
947,2025-06-11,Innovation News Politics Tech Study Election Politics,tech,Anna Johnson,feature,tech,529,53,1
948,2025-02-18,Market Study Politics Change Crash Market Innovation,science,Sarah Martinez,opinion,science,947,52,0
949,2025-11-22,Announces Breaking Government Change,business,James Williams,analysis,business,221,36,1
950,2023-08-26,Announces Market Announces Study,science,Sarah Miller,news,science,1399,32,0
951,2025-07-27,Business News Crash Government Announces Business Innovation,culture,John Jones,feature,culture,1500,60,1
952,2023-04-28,Discovery New Business Science Government Announces Results,business,Michael Smith,news,business,1016,59,1
953,2025-02-17,News Climate Business Innovation Climate Crash Politics World,politics,Jane Jones,analysis,politics,575,61,1
954,2025-02-10,Crash Innovation Market Government,culture,Robert Jones,opinion,culture,668,34,0
955,2024-08-10,World World Market,politics,Anna Davis,feature,politics,1174,18,1
956,2023-10-30,World Election Crash World,science,Emma Davis,analysis,science,1248,26,0
957,2023-01-14,Market Discovery Business Study,culture,Lisa Jones,opinion,culture,1824,31,0
958,2024-08-09,Study Change Change Giant News Climate,world,Lisa Garcia,news,world,563,38,1
959,2024-03-08,News Business News Breaking Culture,tech,Lisa Miller,feature,tech,630,35,0
960,2024-02-17,Science Giant New Politics Discovery Politics Business,world,Emma Martinez,opinion,world,1399,54,0
961,2024-02-26,Results Politics Election,politics,Michael Martinez,analysis,politics,1977,25,0
962,2023-08-24,Discovery Announces Breaking Election New Election,science,Emma Smith,news,science,783,50,1
963,2023-02-18,News Announces Government Discovery Government,business,John Rodriguez,analysis,business,1764,46,0
964,2023-08-04,Giant Change Study Results,business,Sarah Jones,analysis,business,1519,26,0
965,2023-09-11,Politics News Election Market Science,business,Lisa Garcia,feature,business,1774,37,0
966,2023-05-24,Innovation New Climate Breaking Tech Announces New,tech,Robert Rodriguez,opinion,tech,373,50,0
967,2024-04-01,Reveals Election Crash,tech,David Williams,opinion,tech,949,22,0
968,2025-04-25,Business New New,world,John Brown,opinion,world,1612,16,0
969,2024-09-30,Innovation Government Climate Market Climate Innovation Government Announces,science,Emma Rodriguez,feature,science,522,76,0
970,2025-12-28,World Study New Culture Science Culture,culture,Anna Brown,feature,culture,786,39,0
971,2025-09-29,Politics Tech Election Reveals,politics,John Garcia,feature,politics,922,30,0
972,2025-11-19,Crash Results Breaking Study Reveals,world,Jane Miller,news,world,1986,36,0
973,2025-07-29,Change Culture Breaking,world,Jane Rodriguez,news,world,930,23,0
974,2024-09-19,News Government Change Election,politics,Robert Jones,opinion,politics,538,31,0
975,2024-08-02,Market Business Election Climate Breaking Business,culture,David Williams,news,culture,815,50,0
976,2025-09-29,Climate Politics Government Breaking World,tech,Jane Smith,feature,tech,1709,42,1
977,2024-11-22,Government Election Crash Business Reveals Market Science,science,John Smith,opinion,science,1394,57,1
978,2023-03-11,Giant Discovery Business Study,business,James Smith,analysis,business,498,30,0
979,2025-03-20,Innovation Politics Breaking Election Election Change,culture,Anna Johnson,analysis,culture,1012,53,1
980,2023-10-03,Innovation Politics Politics New Election,tech,Jane Brown,feature,tech,1688,41,0
981,2023-03-16,Giant Science Innovation Climate Innovation Government,business,John Garcia,opinion,business,1739,54,0
982,2023-10-23,Study Business Government,science,James Miller,analysis,science,1881,25,0
983,2024-02-09,Culture Politics Culture Breaking Business Crash,politics,Anna Brown,opinion,politics,1899,48,0
984,2025-01-10,Giant Election Business Government Crash Breaking Business,science,Robert Brown,opinion,science,1210,58,1
985,2025-12-17,Climate Science Giant Giant Breaking,business,Jane Jones,opinion,business,680,36,1
986,2023-03-24,Results Innovation Change Study New Science Culture News,politics,Emma Miller,opinion,politics,1891,56,0
987,2023-10-26,Climate Market Results,politics,Anna Rodriguez,opinion,politics,1663,22,1
988,2024-08-01,Discovery New Culture Business Culture News News,science,Emma Rodriguez,opinion,science,812,48,0
989,2025-03-26,Business Tech Business Giant Culture Discovery Innovation Politics,tech,John Davis,news,tech,1695,66,1
990,2024-06-15,Giant Election News Study,science,James Brown,analysis,science,888,25,0
991,2023-09-13,New World Business Announces Discovery Crash Government Politics,politics,David Rodriguez,news,politics,1291,64,0
992,2024-08-24,World Results Government Crash News Results Results Breaking,business,James Jones,opinion,business,1768,60,0
993,2025-10-24,Reveals Giant Science Discovery Politics Market News,world,Lisa Davis,analysis,world,1905,52,1
994,2025-08-18,Discovery Science World Market Announces Change,tech,Lisa Davis,analysis,tech,850,47,0
995,2023-08-05,Study Tech Crash Giant Business,science,John Brown,opinion,science,740,31,1
996,2025-02-03,Climate Politics Government Announces Market,politics,Emma Martinez,news,politics,1916,44,0
997,2024-12-25,Study Innovation Crash,science,Emma Davis,news,science,929,22,0
998,2024-07-01,Business Breaking Climate Science Change Change Election Climate,science,Robert Jones,news,science,978,64,1
999,2024-10-18,Science Study Study Study Change Study,tech,Jane Smith,feature,tech,1531,38,1
1000,2023-09-06,Results World Politics Announces,politics,John Johnson,opinion,politics,1967,32,1
